date,title,source,length,body,subject
2022-05-13,Shanghai to ease COVID-19 restrictions in mid-May,China Daily,833,"By WANG XIAOYU | chinadaily.com.cn | Updated: 2022-04-19 14:08
China has entered a new stage of its fight against the COVID-19 epidemic that calls for earlier detection and faster actions to cope with the rapidly spreading Omicron variant, Ma Xiaowei, minister of the National Health Commission, said.
Faced with the highly transmissible Omicron strain, the country should roll out the strictest, most thorough and resolute measures to coordinate comprehensive steps and cut transmission in the shortest possible time, he said in a signed article published on Monday.
Relaxing COVID-19 disease control measures will threaten to overstretch the country's unevenly distributed medical systems and hurt its large number of seniors and vulnerable people, he said.
In the article, Ma made it clear that China has entered the fourth stage of its fight against the disease. The first three phases were: stemming out the epidemic centering in Hubei province; exploring and implementing regular disease control measures; and initiating the dynamic zero-COVID strategy.
While urging unswerving adherence to the dynamic zero-COVID strategy, Ma said upgraded measures are needed in the current stage, such as adding antigen tests to mass screening campaigns and expanding the capacity of quarantine facilities and makeshift hospitals.
The article was published on Study Times, a newspaper administered by the Party School of the Central Committee of the Communist Party of China. It comes at a time when China is battling a severe wave of COVID-19 outbreaks fueled by the highly infectious Omicron variant, and its economic powerhouse Shanghai has been confronting surging infections for weeks.
As the recent epidemic triggered debates over the rationality of persisting with the dynamic clearance approach, Ma said it is essential to take a clear-cut stand against erroneous thoughts such as ""coexisting with the virus"" or ""the novel coronavirus is becoming flu-like.""
""We must continue to improve our disease control measures and achieve the goal of cutting transmission in communities in the most determined, resolute and comprehensive manner,"" he said.
The fundamental goal of adopting the dynamic zero-COVID policy has always been safeguarding the health of our people, he said.
China's national conditions - home to the world's largest population, uneven development across vast amounts of land and a shortage of overall healthcare resources - have determined that easing disease control measures in the face of frequent COVID-19 resurgences will take a heavy toll on people's lives and social and economic development, he said.
""If we abandon prevention efforts and relax treatment measures, China's medical systems will be overwhelmed and the health of its large number of people with underlying illnesses, the elderly, children and pregnant women will be at risk,"" he said.
""Such consequences will not be accepted by our people, nor will it be allowed to happen under the leadership of the Party and government,"" he said.
Upgraded measures needed
Ma also stressed the need to tailor disease control tool kits to cope with the current principle strain of Omicron that transmits in a faster and more covert way than the Delta strain, its predecessor.
Because a large proportion of Omicron cases are asymptomatic, China's monitoring defense against COVID-19 should be strengthened.
""In addition to fever sentinel clinics, mass screening of key groups and rapid reports, we should make full use of the rapid and convenient antigen tests and integrate the method with nucleic acid testing,"" he said.
As the fast-spreading Omicron can lead to a spike in new cases in a short period, Ma said the shortage of quarantine sites and temporary hospitals - the most acute problem at the moment - must be addressed.
Only when sufficient isolation facilities are provided and when all asymptomatic and mild patients are admitted into makeshift hospitals will we be able to effectively control Omicron outbreaks while guaranteeing smooth and consistent provision of normal medical services, he said.
To further relieve burden on healthcare systems, Ma requires the timely triage of COVID-19 patients. He clarifies that people who show pneumonia symptoms, suffer chronic diseases, the elderly and children should be admitted into designated hospitals.
""Mild and symptom-free cases should be received by makeshift hospitals and recovered patients should return home for self-isolation, so as to prevent them from taking up daily hospital resources,"" he said.
In the meantime, Ma stressed that heightened attention should be given to meet normal medication and healthcare demands of the people.
""General hospitals, children's hospitals and maternal and child care health centers should provide regular services as usual (during a local outbreak),"" he said, adding that special channels in locked-down areas should be provided for people in need and that those with chronic diseases or in critical conditions should be arranged to go to a hospital.","COVID CORONAVIRUS (94%); COVID-19 CORONAVIRUS (93%); COMMUNICABLE DISEASE CONTROL (90%); COVID-19 CORONAVIRUS REGULATION & POLICY (90%); DISEASES & DISORDERS (90%); INFECTIOUS DISEASE (90%); PUBLIC HEALTH (90%); EPIDEMICS (89%); COMMUNISM (79%); ISOLATION & QUARANTINE (78%); SOCIETY, SOCIAL ASSISTANCE & LIFESTYLE (78%); CORONAVIRUSES (77%); ECONOMIC DEVELOPMENT (77%); HEALTH DEPARTMENTS (77%); VIRUSES (77%); NEGATIVE NEWS (76%); VULNERABLE ADULTS (75%); SENIOR CITIZENS (74%); VULNERABLE HEALTH POPULATIONS (74%); WOMEN'S HEALTH (73%); CHILDREN (70%); BUSINESS NEWS (69%); POLITICAL PARTIES (66%); PREGNANCY & CHILDBIRTH (60%); SHORTAGES (50%)"
2022-04-19,Ma Xiaowei calls for stronger COVID-19 measures,China Daily,248,"By Cao Chen in Shanghai | chinadaily.com.cn | Updated: 2022-07-08 20:05
Measures have been implemented in the Pudong New Area in Shanghai to protect students attending the ongoing college entrance exams and the high school entrance exams to be held next week, as a locally transmitted COVID-19 case has been found in the area, according to local authorities.
The city reported one locally transmitted COVID-19 confirmed case outside of quarantine and lockdown communities on Friday. The Kangqiao Town in Pudong New Area, the residential neighborhood of the case, was listed as a high-risk area.
So far, 137 exam candidates are from high- and medium-risk areas in the region, Yan Bo, vice governor of the Area, said at a press conference on Friday. Those under centralized quarantine or with abnormal nucleic acid results took the exams at designated test sites.
Yan noted the prevention and control measures guarantee smooth transport on students' way to exam sites, and have closed-loop management and personnel transfer at emergencies related to COVID-19 before and during the exams.
A total of 81 designated nucleic acid sampling sites have offered services to all exam candidates who were required to take two nucleic acid tests within three days before the exam, according to Yan. Those living in medium- and high-risk areas can enjoy door-to-door testing services according to their needs, he said. He added that psychological consultation services are available for the examinees as well.",COVID CORONAVIRUS (91%); COVID-19 CORONAVIRUS (91%); ACADEMIC TESTING (90%); INFECTIOUS DISEASE (90%); SCHOOL ENTRANCE EXAMS (90%); STUDENTS & STUDENT LIFE (90%); ISOLATION & QUARANTINE (77%); PRESS CONFERENCES (73%); SECONDARY SCHOOLS (57%)
2022-07-08,Students well protected as new COVID-19 case found in Shanghai,China Daily,667,"By MAY ZHOU in Houston | China Daily Global | Updated: 2022-04-27 09:46
Houston resident Julie Joe has been suspecting that she might have already had caught COVID-19, although she didn't have a positive test to prove it. Her middle-school daughter has had flu like symptoms a couple of times since the spring semester began and she herself felt somewhat sick following her daughter's episodes.
She might be right to assume so because new findings released Tuesday by the Centers for Disease Control and Prevention (CDC) suggest that 6 out of 10 adult Americans &mdash; almost 200 million &mdash; and 3 in 4 children have had COVID-19 infections. That far exceeds the 80.8 million cases officially tallied by the CDC as of Tuesday.
The rate of previous infection was even higher among children, at 75 percent among those 11 years old and under. The level was much lower, around 33 percent, among those over 65.
The study's authors estimated ""seroprevalence"" caused by a prior infection &mdash; the presence of antibodies against the virus &mdash; based on samples gathered from thousands of routine blood draws from around the country.
""We know that the reported cases are just the tip of the iceberg,"" said Dr Kristie Clarke, co-lead for the CDC's COVID-19 Epidemiology and Surveillance Taskforce Seroprevalence Team, during a press briefing on Tuesday.
Cases can go undetected if people don't develop symptoms, don't get tested, or use at-home rapid tests that aren't reported to public health officials. Forthcoming CDC research estimates there actually may be three people infected for every case officially reported during the Omicron variant wave, Clarke added, suggesting that millions of cases were missed as the highly contagious variant spread.
The seroprevalence study by CDC is a repeated and cross-sectional national survey that estimates the proportion of the population in 50 states, the District of Columbia and Puerto Rico that has infection-induced antibodies to COVID-19 between September 2021 and February 2022.
More than 200,000 blood samples were analyzed for virus-fighting antibodies anti-nucleocapsid (anti-N) made from infections, not the vaccines, during the study. It found out that prior to December last year, the seroprevalence increase rate was less than 2 percent every four weeks.
Between December 2021 to February 2022, when Omicron was spreading, seroprevalence increased from around 45 percent to 75 percent among children age o-17. That means 30 percent of the young population was infected in three months.
Seroprevalence from December to February increased from 36.5 percent to 63.7 percent among adults aged 18-49 years old. That ratio is lower for older people &mdash; it reached roughly 50 percent among people ages 50-64 and 33 percent among those age 65 or older.
""These findings illustrate a high infection rate for the Omicron variant, especially among children,"" the CDC said.
The CDC cautioned that the findings in its report are subject to some limitations. All samples were obtained for clinical testing and might overrepresent persons with greater healthcare access or who more frequently seek care.
The findings might underestimate the cumulative number of coronavirus infections because those after vaccination might result in lower anti-N titers that cannot account for reinfections.
CDC officials warned that having previously been infected doesn't necessarily mean that someone is protected going forward, given that immunity can wane over time. The CDC says vaccination remains the safest strategy for preventing COVID-19 complications and recommends vaccination for all eligible persons, including those with previous infections.
Also on Tuesday, US Vice President Kamala Harris tested positive for COVID-19, a spokesperson said in a statement.
Harris has exhibited no symptoms and has not been a close contact to President Joe Biden, Harris' press secretary Kirsten Allen said.
She will isolate and return to the White House when she tests negative, Allen said.",COVID CORONAVIRUS (93%); COVID-19 CORONAVIRUS (92%); EPIDEMIOLOGY (91%); CHILDREN (90%); INFECTIOUS DISEASE (90%); PUBLIC HEALTH (90%); PUBLIC HEALTH ADMINISTRATION (90%); ADULTS (89%); DISEASE REPORTING (78%); DISEASES & DISORDERS (78%); INFLUENZA (78%); PUBLIC HEALTH SURVEILLANCE (78%); VACCINES (78%); HEALTH DEPARTMENTS (76%); RESEARCH REPORTS (76%); PREVENTION & WELLNESS (75%); PRESS CONFERENCES (73%); SURVEILLANCE (73%); POLLS & SURVEYS (71%); SENIOR CITIZENS (67%); PUBLIC OFFICIALS (65%)
2022-04-27,CDC: 6 in 10 Americans have had COVID-19,China Daily,650,"By KARL WILSON in Sydney | China Daily | Updated: 2022-05-19 09:50
Lifting of measures, 'let it rip' approach see surge in fresh infections, deaths
No one in Australia talks about the COVID-19 pandemic anymore. It no longer dominates the news and has hardly received a mention during the general election campaign.
Public health measures such as lockdowns, social distancing, quarantine and contact tracing－measures applied to suppress the pandemic over the past two years－have been quietly removed, to the relief of the business community.
Much of this happened in the run-up to Christmas, as the Delta and Omicron strains were taking hold. The numbers of infections and deaths have since skyrocketed, even with one of the world's highest vaccination rates.
Despite the surge in cases, most state premiers have been determined to hold the line, allowing the virus to circulate in their communities, which critics have labeled the ""let it rip"" approach.
According to data from Johns Hopkins University Center for Systems Science and Engineering, the number of COVID-19 deaths in Australia totaled 7,926 as of early Wednesday. The number of cases was 6.76 million.
Western Australia, the last state in the Commonwealth to hold out against opening its borders, finally did so on March 3. Case numbers have risen from a few hundred daily to 25,000 daily cases as of Sunday.
Nationwide in January, 1,519 COVID-19 deaths were reported－49 a day, making it the leading cause of death in Australia, ahead of ischemic heart disease. A report by the Australian Bureau of Statistics revealed that there were 2,865 excess deaths, or 22.1 percent more than the historical average, in that month.
Exhausted medics
Health and eldercare workers are exhausted. Teachers are exhausted. Employers are finding it difficult to fill positions as workers self-isolate after contracting the virus.
General practitioners who have been on the front line of the pandemic response are now on the front line of the cleanup. There is two years' worth of missed checkups, delayed tests and mental health concerns.
Professor Catherine Bennett, chair of epidemiology at Deakin University in Queensland, told China Daily: ""As we cannot stop exposure (to the virus), it is important we learn more about who is still getting very sick with their infections, and whether there are ways we can prevent that.""
She urged looking at ""how easily people can access antivirals and if certain subgroups are more vulnerable and need better information or support"".
""With the virus here to stay, it's critical we keep working to reduce its burden and the deaths associated with it as much as we can,"" she said.
The case numbers since the start of the year have risen due to several factors, including the relaxing of restrictions, more transmissible variants with immune-evading capacities, waning immunity, fatigue in the population, and seasonal factors, according to Hassan Vally, associate professor in epidemiology at Deakin University.
""Importantly, however, we have an impressive vaccination coverage. And despite vaccine immunity waning, the vaccines hold up very well in terms of protecting against severe disease.""
Vally said the future lies in targeting interventions to protect the most vulnerable and to make changes to society and the built environment, such as improving ventilation, to mitigate the spread of COVID-19.
Professor Adrian Esterman, chair of biostatistics and epidemiology at the University of South Australia, said he felt governments around Australia had stopped listening to public health advice.
""The majority of Australians just want the COVID-19 epidemic to be over, and our leaders are telling us it is over.
""As Jon Snow said in Game of Thrones, 'Winter is coming.' The flu season is on us, and laboratory confirmed cases are rising rapidly in Australia. This will also put increased pressure on our hospital system,"" Esterman said.",COVID CORONAVIRUS (92%); COVID-19 CORONAVIRUS (91%); DEATH & DYING (90%); EPIDEMICS (90%); INFECTIOUS DISEASE (90%); PANDEMICS (90%); PUBLIC HEALTH (90%); EPIDEMIOLOGY (89%); SOCIAL DISTANCING (89%); VACCINES (78%); DEATH RATES (77%); DISEASES & DISORDERS (77%); PUBLIC HEALTH ADMINISTRATION (77%); ELECTIONS (76%); STATISTICS (73%); VACCINATION & IMMUNIZATION (73%); COLLEGE & UNIVERSITY PROFESSORS (72%); COLLEGES & UNIVERSITIES (72%); EDUCATIONAL INSTITUTION EMPLOYEES (72%); ENGINEERING (72%); HEART DISEASE (72%); CAMPAIGNS & ELECTIONS (71%); ELECTIONS & POLITICS (71%); GOVERNMENT STATISTICS AGENCIES (69%); TERRITORIAL & NATIONAL BORDERS (52%); CARDIOVASCULAR DISEASE (50%); MENTAL HEALTH (50%)
2022-05-19,"As Australia moves on, COVID-19 cases rise up",China Daily,464,"By CAO YIN | China Daily | Updated: 2022-05-16 09:31
After 32 days in treatment, Ye Ming, 108, recovered from COVID-19 and was discharged from Shanghai Pudong Hospital on Saturday, setting a record for the oldest person to recover from a severe infection across China.
According to a People's Daily report, Ye, who has a history of stroke, coronary heart disease and other medical issues, was weak when he was first hospitalized.
To better treat the elderly patient, the hospital directed experts and nursing teams - including those specializing in cardiology, geriatrics, respiratory medicine and traditional Chinese medicine - to focus more on him. He was transferred to the intensive care unit due to his critical condition and underlying illnesses, it said.
Thanks to the premium care and comprehensive treatment, Ye had tested negative in two consecutive nucleic acid tests at least 24 hours apart by Saturday, which meant he could be discharged from the hospital, according to the report.
About two weeks ago, Wang Manru, a 93-year-old woman, also recovered from COVID-19 and was discharged from a makeshift hospital in the Lingang area of Shanghai.
Coincidentally, both Ye and Wang worked at the Shanghai No 3 People's Hospital many years ago, and they worked together to provide medical assistance in the War to Resist US Aggression and Aid Korea (1950-53).
At a recent ceremony held by the makeshift hospital to celebrate Wang's recovery, the retired nurse showed an old photo that included herself and Ye to medics. She said she was really impressed with Ye, who was an anesthesiologist.
""After all, there were only three people in the first batch of medical workers from the Shanghai No 3 People's Hospital helping during the war,"" recalled Wang, who dedicated her life to pediatric care after she returned from the war until she retired.
People's Daily reported that Ye also contributed to the War of Resistance Against Japanese Aggression (1931-45), adding that he helped collect medicine and medical equipment for soldiers at that time.
At a news conference on Sunday, Zhao Dandan, deputy director of the Shanghai Health Commission, said he wished for Ye and Wang to recover quickly, pointing out their heroic efforts for the country.
Since the city was hit by the current epidemic in March, officials have prioritized providing comprehensive medical treatment and paying extra attention to elderly COVID-19 patients, especially those with severe infections, to alleviate their existing health conditions while treating them with antiviral therapies.
Medical teams have been required to increase their monitoring of such patients in the early stages and intervene as soon as possible to prevent a mild case from developing into a severe one, said Wu Qianyu, a health commission official.",COVID CORONAVIRUS (91%); COVID-19 CORONAVIRUS (91%); DISEASES & DISORDERS (90%); INFECTIOUS DISEASE (90%); HEALTH DEPARTMENTS (89%); LEVELS OF CARE (89%); MEDICINE & HEALTH (89%); SENIOR CITIZENS (89%); CARDIOVASCULAR DISEASE (78%); HEALTH CARE PROFESSIONALS (78%); INTENSIVE CARE UNITS (78%); MEDICAL TREATMENTS & PROCEDURES (78%); PHYSICIANS & SURGEONS (78%); CARDIOLOGY (77%); GERIATRICS (77%); HEART DISEASE (77%); MEDICAID (77%); MEDICAL DEVICES (77%); NURSES & NURSING (77%); PUBLIC HEALTH (77%); ALTERNATIVE MEDICINE (73%); PRESS CONFERENCES (73%); WAR & CONFLICT (71%); TRENDS & EVENTS (70%)
2022-05-16,China's oldest severe COVID-19 patient recovers,China Daily,576,"By SHADOW LI and PHILIP TUBEZA in Hong Kong | China Daily | Updated: 2022-03-04 07:30
144 deaths also recorded as city official calls for unity at 'height of the epidemic'
Hong Kong reported a record 56,827 new COVID-19 cases on Thursday as the government called for united efforts to battle the city's worst outbreak.
It also recorded 144 deaths related to COVID-19. Only 20 of the deceased had received at least one vaccine shot. There were also 42 deaths that were not reported earlier due to information delays.
""While we are at the height of the epidemic, we must remain united and, with the support of the government, we can win in this fifth wave,"" Chui Tak-yi, undersecretary for food and health, told the daily news briefing.
The Hong Kong Special Administrative Region government said on Thursday that fighting against the pandemic was the overriding mission of all civil servants, regardless of the departments they belong to.
Staff members of 39 departments under eight bureaus are engaged in small-scale lockdown operations, according to the government.
In the past three days, over 30 such operations, involving COVID-19 tests for tens of thousands of residents, were carried out.
Retired chief inspector of police Luk Hoi-ho lent a hand at the front line of the ""silent war"". Luk and 500 others, mostly retired members of the city's disciplined forces, helped residents in these small-scale lockdown areas get registered and delivered supplies.
""We understand how heavy the burden is for people fighting against the pandemic on the front line, like medical workers, and we felt it is the responsibility of people like us－who have time and the relevant skills－to come to help,"" Luk said.
""Every day is an unforgettable memory. We are fighting a silent war against an invisible enemy.""
About 1,000 government employees were deployed to answer calls on a 24-hour telephone hotline to provide assistance to residents in distress, including confirmed patients and those under home quarantine.
While the Constitutional and Mainland Affairs Bureau is planning this month's scheduled mass testing program, staff members of the Civil Service Bureau are leaving no stones unturned to find venues for vaccination. Current and some former members of the disciplined services have been mobilized to take up management duties at community isolation and treatment facilities.
The government said that from April 1, civil servants wishing to enter government buildings will need to have had two shots of COVID-19 vaccine.
Leading a team of mainland health experts in Hong Kong, Liang Wannian, head of the COVID-19 response expert panel under mainland's National Health Commission, said they are still analyzing the current pandemic situation and will discuss relevant issues with Hong Kong experts before coming up with any suggestions.
He said he is confident about Hong Kong's ability to overcome the pandemic, noting its high-quality medical resources and good governance.
With the central government's help, the strong leadership of the SAR government, the united efforts of all sectors and the city's solid experience in combating severe acute respiratory syndrome in 2003, Hong Kong will surely win this battle, Liang reassured residents.
The overriding mission is to reduce transmission, infections and severe cases. The limited resources and attention should be focused on high-risk groups, places and organizations, Liang said.
Chen Shuman contributed to this story.",COVID CORONAVIRUS (91%); COVID-19 CORONAVIRUS (91%); CITY GOVERNMENT (90%); DISEASES & DISORDERS (90%); INFECTIOUS DISEASE (90%); PUBLIC HEALTH (90%); PUBLIC OFFICIALS (90%); CIVIL SERVICES (89%); PANDEMICS (89%); VACCINES (89%); HEALTH DEPARTMENTS (77%); ISOLATION & QUARANTINE (77%); VACCINATION & IMMUNIZATION (77%); GOVERNMENT & PUBLIC ADMINISTRATION (76%); GOVERNMENT ADVISORS & MINISTERS (71%); HEALTH CARE PROFESSIONALS (68%)
