date,title,source,length,body,subject
2022-05-14,Shanghai's COVID-19 battle sees big progress,China Daily,516,"By ANGUS McNEICE in London | China Daily Global | Updated: 2021-12-10 09:10
A person wipes a table inside a COVID-19 mobile testing site, as the spread of the coronavirus disease (COVID-19) continues in London, Britain, Nov 29, 2021. [Photo/Agencies]
The United Kingdom has launched a trial to test a COVID-19 treatment that can be taken in pill form at home, potentially reducing the risk of severe symptoms and hospitalizations.
The UK-wide PANORAMIC clinical trial, led by the University of Oxford, is assessing the antiviral pill Molnupiravir in 10,000 people who register for the study and go on to test positive for COVID-19.
Eligible candidates include those aged 50 years and older, and 18 to 49 year olds with underlying health conditions, or who have been unwell with COVID-19 for less than five days.
The government announced that, from Dec 16, Molnupiravir will also be made available outside the study, to people at the highest risk of severe illness, including those who are immunocompromised, cancer patients, and those with Down's Syndrome.
Previous trials have shown that Molnupiravir can reduce the risk of hospitalization or death in adults with mild to moderate COVID-19 by 30 percent.
Health Secretary Sajid Javid called the national study a ""historic milestone in our battle against the virus"", paving the way for the first medicines that people will be able to take ""in the comfort of their own homes to protect themselves"".
Chris Butler, a primary care professor at University of Oxford and chief investigator on the trial, said participants will have the drug sent directly to their homes.
""It's vital that as many people as possible who are at higher risk from complications of COVID-19 join the trial, so we can rapidly learn if exciting new treatments really do help people get better quicker and reduce pressures on the National Health Service,"" Butler said.
The UK's deputy chief medical officer, Jonathan Van-Tam, said that antiviral drugs could provide a ""vital intervention for years to come"". The UK has achieved high vaccination coverage, though the rate of infections is still high, averaging almost 48,000 per day this week, and there are concerns that existing vaccines may be less effective against new variants, including Omicron.
Molnupiravir, an experimental antiviral initially developed to treat influenza, performed well in clinical trials for the treatment of COVID-19 this fall, after which the UK drug regulator approved the drug for use in November.
The UK ordered 480,000 courses of Molnupiravir from pharmaceutical company Merck Sharp and Dohme in October, in preparation for a spike in COVID-19 infections this winter.
The UK also ordered 250,000 courses of Ritonavir, another drug that can be taken in pill form. Ritonavir is most commonly used to treat HIV/AIDS, and the antiviral has shown promise in reducing severe illness and hospitalization from COVID-19 in trials run by Pfizer.
The PANORAMIC program will next launch a nationwide trial for Ronapreve, a novel monoclonal antibody treatment for COVID-19, with more drug trials to follow under the program.","COVID CORONAVIRUS (94%); COVID-19 CORONAVIRUS (94%); DISEASES & DISORDERS (90%); INFECTIOUS DISEASE (90%); PUBLIC HEALTH (90%); CLINICAL TRIALS (89%); HEALTH DEPARTMENTS (89%); VACCINES (89%); ADULTS (78%); CANCER (78%); DISEASE IMMUNITY (78%); DRUG & MEDICAL DEVICES APPROVAL (78%); LEVELS OF CARE (78%); MEDICAL TREATMENTS & PROCEDURES (78%); VACCINATION & IMMUNIZATION (78%); CORONAVIRUSES (77%); MEDICINE & HEALTH (77%); VIRUSES (77%); EXPERIMENTAL DRUGS (76%); COLLEGES & UNIVERSITIES (75%); INFLUENZA (75%); HEALTH CARE PROFESSIONALS (73%); CONGENITAL DISORDERS (72%); DOWN SYNDROME (72%); APPROVALS (71%); COLLEGE & UNIVERSITY PROFESSORS (70%); GOVERNMENT ADVISORS & MINISTERS (67%); NATIONAL HEALTH INSURANCE (67%); INVESTIGATIONS (66%); EXECUTIVES (63%)

Company:  MERCK SHARP & DOHME IA CORP (50%)"
2021-12-10,UK testing COVID-19 treatment on thousands,China Daily,443,"By EDITH MUTETHYA in Nairobi, Kenya | China Daily | Updated: 2022-04-12 10:01
Health experts in Africa are calling for caution in the easing of COVID-19 restrictions across the continent, following a decline in the number of new cases since January.
""Our analysis is clear evidence of the continued significant circulation of the COVID-19 virus amongst people on the continent. With this comes the heightened risk of more lethal variants that can overwhelm existing immunity,"" said Matshidiso Moeti, the World Health Organization's regional director for Africa, on Thursday.
John Nkengasong, director of the Africa Centres for Disease Control and Prevention, urged African governments to continue promoting health measures as well as increasing vaccination rates even as they ease curbs. He warned that the lifting of restrictions may also lead to reinfection as has been the case in Europe and other parts of the world.
Juma Maleve, a clinical officer from Kenya's coastal city of Mombasa, also shared similar sentiments and warned Africans against interpreting ease of restrictions to mean that COVID-19 is over.
Warning issued
""We are not safe until the pandemic is declared over globally. We are just in a low season of COVID-19 transmissions. We may not know whether there will be an upsurge of another variant, so we have to remain vigilant,"" Maleve said.
He specifically warned Kenyans, who are no longer observing health measures after the government lifted the remaining COVID-19 restrictions on March 11.
According to data from the Africa CDC, about 16 percent of the African population is fully vaccinated compared to the global average of 57 percent.
The total number of confirmed COVID-19 cases in Africa has exceeded 11 million, though a fresh analysis conducted by the WHO reveals that available data is likely only scratching the surface of the real extent of infections in the continent. The WHO said the true number of infections could be as much as 97 times higher than the number of confirmed reported cases. It also suggested that more than two-thirds of all Africans have been exposed to COVID-19.
Following a decline in new reported COVID-19 cases recently, many African countries have eased pandemic prevention and control measures. At least 19 African countries have eased restrictions on mass gatherings, according to WHO data. By mid-March, 22 African countries were no longer carrying out any kind of contact tracing.
Last week, South Africa, the most hard-hit country in the continent, lifted most of the mandatory measures, with the remaining restrictions, including those for gatherings and international travel, expected to lapse by May 4.",COVID CORONAVIRUS (94%); COVID-19 CORONAVIRUS (93%); COVID-19 CORONAVIRUS REGULATION & POLICY (90%); EPIDEMIOLOGY (90%); INFECTIOUS DISEASE (90%); PUBLIC HEALTH (90%); COMMUNICABLE DISEASE CONTROL (89%); EPIDEMICS (89%); PANDEMICS (89%); DISEASE CONTACT TRACING (78%); PREVENTION & WELLNESS (78%); VACCINATION & IMMUNIZATION (78%); VACCINES (78%); PUBLIC HEALTH ADMINISTRATION (77%); DISEASE REPORTING (76%); DISEASES & DISORDERS (76%); HEALTH DEPARTMENTS (73%); ASSOCIATIONS & ORGANIZATIONS (70%); UNITED NATIONS INSTITUTIONS (70%)
2022-04-12,Africans need to remain vigilant on COVID-19 risks,China Daily,210,"By XING YI in Shanghai | chinadaily.com.cn | Updated: 2022-04-27 14:34
Residents living in areas that have zero COVID-19 community transmission will be permitted limited mobility, the Shanghai municipal government announced on Wednesday.
The city reported 1,606 confirmed COVID-19 cases and 11,956 asymptomatic infections on Tuesday, a big fall in numbers compared with the previous day. Moreover, only 171 of these individuals were from outside controlled or closed-loop management zones, according to statistics from the municipal health commission.
Zhao Dandan, deputy director of the municipal health commission, said that though efforts to break the transmission chains have started to show good results, the overall epidemic situation is still ""very grim"".
Stringent epidemic control measures including closed-loop management, nucleic acid and antigen testing, thorough epidemiological investigation and disinfection will continue in areas that have yet to achieve zero community transmission, Zhao added.
Another round of nucleic acid and antigen testing will take place from Wednesday to Saturday based on each compound's current risk level. The list of locked down, controlled and precautionary areas will then be adjusted based on the test results, Zhao added.",COVID CORONAVIRUS (91%); COVID-19 CORONAVIRUS (91%); EPIDEMICS (90%); EPIDEMIOLOGY (90%); INFECTIOUS DISEASE (90%); PUBLIC HEALTH (90%); INVESTIGATIONS (78%); NEGATIVE PERSONAL NEWS (77%); HEALTH DEPARTMENTS (76%); CITIES (72%); CITY GOVERNMENT (72%); REGIONAL & LOCAL GOVERNMENTS (72%); STATISTICS (72%); GOVERNMENT & PUBLIC ADMINISTRATION (57%)
2022-04-27,Shanghai reports dip in COVID-19 numbers,China Daily,324,"By WANG XIAOYU | China Daily | Updated: 2022-09-05 08:45
China's CanSino Biologics said on Sunday that its inhalable COVID-19 vaccine has been given emergency use authorization by the country's top drug regulator.
The dose is an aerosolized version of a single-shot, adenovirus-based viral vector vaccine already in use domestically and worldwide. It will be used as a booster only, according to the notice.
It is the first aerosolized vaccine to be approved for public use in China. All nine vaccines that have obtained either conditional market approval or emergency use approval from the National Medical Products Administration so far, are delivered intravenously.
An aerosolized COVID-19 vaccine has emerged as a promising field of research due to its easy accessibility and unique way of stimulating protection, according to experts.
Sunney Xie Xiaoliang, a biophysical chemist at Peking University and an academician of the Chinese Academy of Sciences, said during a forum in Beijing over the weekend that aerosolized vaccines could be an effective way to protect against respiratory diseases, including COVID-19, in the future.
The nasal cavity is the body's first barrier to the novel coronavirus. Delivering vaccines via this route can stimulate immune responses on mucosal surfaces where viruses enter, according to Xie.
""Using it as a booster shot can also trigger higher levels of humoral immunity as well as cellular immunity, which are potentially capable of clearing the virus within a shorter period,"" he said.
The most recent published study on aerosolized vaccines shows that when given as a booster, the vaccine candidate stimulated a stronger antibody response in fully vaccinated adults than an inactivated jab.
The study was conducted in China and published in early August on medRixv, a preprint platform.
""Orally administered aerosolized vaccines might become a valuable addition to the existing SARS-CoV-2 vaccine pools,"" it said.","VACCINES (98%); COVID CORONAVIRUS (93%); COVID-19 CORONAVIRUS (93%); VIRUSES (91%); APPROVALS (90%); DRUG & MEDICAL DEVICES APPROVAL (90%); INFECTIOUS DISEASE (90%); RESPIRATORY DISORDERS & INJURIES (90%); CORONAVIRUSES (89%); DISEASE IMMUNITY (78%); DISEASES & DISORDERS (77%); EXPERIMENTATION & RESEARCH (74%); IMMUNOLOGY (74%); RESEARCH REPORTS (74%); SCIENCE & TECHNOLOGY (73%); SARS (71%); BIOPHYSICS (69%)

Company:  NATIONAL MEDICAL PRODUCTS CO (56%)"
2022-09-05,Aerosolized COVID-19 vaccine approved by national regulator for emergency use,China Daily,490,"By Edith Mutethya in Nairobi, Kenya | chinadaily.com.cn | Updated: 2022-02-14 18:36
The number of new COVID-19 infections in Africa continues to decline as countries scale up vaccination to achieve herd immunity, as the continent marked two years since reporting the first COVID-19 case on Monday.
According to data from Africa Centers for Disease Control and Prevention, between Jan 31 and Feb 6 the continent reported a 29 percent decrease in the number of new cases.
COVID-19 deaths also declined by 6 percent compared with the previous week when fatalities were on an upward trend.
The highest proportion of new cases came from the northern Africa region, accounting for 68, followed by the southern region with 21 percent.
Among the five countries that reported the highest number of new cases, four were from northern Africa &mdash; Tunisia leading with 35, 640 cases followed by Libya with 23,284, Egypt with 15,963 and Morocco with 14,527 new cases.
South Africa reported the third highest number of new cases at 20, 106.
So far, 40 member states of the African Union have reported the Omicron variant and according to Africa CDC director John Nkengasong, since November six member states have reported the Omicron BA.2 sub-lineage.
Nkengasong said the sub-lineage is currently the dominant variant in South Africa but noted there should be no cause for alarm provided people continue to observe the health measures of wearing face masks when in public and observing social distance as well as getting vaccinated.
""Even if transmissibility of the sub-lineage is higher than the parent Omicron, there is no severity of disease and no differences in vaccine response,"" he said.
To date, Africa has fully vaccinated 11.7 percent of its population against COVID-19 and even though the continent lags behind on the rate of vaccination compared to other parts of the world, it now has a steady supply of vaccines.
Data from the World Health Organization indicate the continent has received around 672 million doses of COVID-19 vaccines, of which 65 percent were facilitated by COVAX, 29 percent via bilateral deals and six percent though the African Union's Vaccines Acquisition Trust.
To further enhance vaccine uptake across the continent, Nkengasong said plans are underway to launch the African Youth for COVID-19 Vaccination Initiative in the next two weeks.
The campaign, which will be spearheaded by the AU Commission youth division and the AU Youth Envoy, is aimed at encouraging young people to get vaccinated.
""We believe strongly that if we don't engage the youth and take ownership and leadership of this, we will continue to struggle to get the 70 percent target,"" Nkengasong said.
""The bulk of who we see as hesitant to vaccines are probably young people. If they step in and show ownership and leadership and recognize that this is a generational crisis and if we don't get them involved and solve it, we will continue to live with the virus.""",COVID-19 CORONAVIRUS (93%); COVID CORONAVIRUS (92%); INFECTIOUS DISEASE (90%); PUBLIC HEALTH (90%); VACCINES (90%); DISEASES & DISORDERS (89%); EPIDEMIOLOGY (89%); HEALTH DEPARTMENTS (89%); PUBLIC HEALTH ADMINISTRATION (89%); VACCINATION & IMMUNIZATION (89%); DISEASE IMMUNITY (78%); SOCIAL DISTANCING (78%); TRENDS (78%); PREVENTION & WELLNESS (77%); DEATH & DYING (76%); ASSOCIATIONS & ORGANIZATIONS (66%); UNITED NATIONS INSTITUTIONS (60%)
2022-02-14,Africa experiences decline in COVID-19 cases,China Daily,1107,"By Nap Ki Li | chinadaily.com.cn | Updated: 2022-04-12 09:14
Global confirmed COVID-19 cases have been rising since Omicron replaced Delta as the dominant variant. Due to the mild symptoms of Omicron, in addition to the fact that many infected patients can recover on their own, people's attitude toward both the seriousness of the pandemic and the acceptability of restrictive measures have been changing dramatically.
From an individual perspective, besides cooperating with the local government's measures against COVID-19, being aware of personal protection, such as wearing a surgical mask, getting vaccinated and social distancing, may well be the only factor we can control. Nevertheless, one may find three noteworthy elements throughout the process of confronting COVID-19, namely humility, reflection and gratitude.
Be humble
Since the end of 2019, mass spread of COVID-19 has been reported around the world. In view of the unexpected crisis, on one hand was the worry of people living in the infected areas, on the other hand was the ridicule from some who lived elsewhere. Various concepts were noticed along with the pandemic development. Not only did it reflect the ignorance and arrogance of those who said such words, but it also revealed the fact that they were not prepared for the possibility of going through the same catastrophe.
Soon after, we all witnessed the United States, who has the most advanced technology and developed medical system, almost totally failed in the face of the spread of COVID-19. According to statistics provided by Johns Hopkins University, as of April 9, 2022, over 80 million total cases and over 985,000 deaths were recorded there. If we take a look at the most recent data from the World Bank, the entire population of the United States in 2020 was 329 million.
Instinctive feelings aside, are we prepared for the same situation in order to avoid making the same mistakes, or just simply seeing oneself as smarter and more exceptional? For instance, some of the following typical problems may still be found in different cities, including but not limited to the problem of the collapse of the medical system, the problem of insufficient quarantine facilities, the problem of epidemiological investigations lagging behind, the problem of formulating appropriate emergency plan (e.g. timetable for mass testing), the problem of adjusting restrictive measures (e.g. the criteria or indicator) and the problem of the supply of daily necessities. While watching numerous examples of pride going before a fall, one should stop and look in the mirror.
In this regard, being humble is important, because we may encounter the same challenges, may make the same mistakes and may need the same assistance. Humility allows one to learn to let go of pride and put oneself in the other's shoes.
Be reflective
As a famous online quote said, ""There is indeed no carefree time, but someone has been shouldering the burden for you"". In light of COVID-19, a significant number of medical staff, law enforcement, cleaning staff and logistics staff, have been working on the front lines subjected to varied extent of infection risks. Although the phenomenon of the so-called anti-pandemic fatigue is not surprising, some misbehaviors may in fact break the law, moreover jeopardize the efforts of those who have been keeping up their good work silently.
One should realize that, no matter how others behave, it cannot be an excuse for abandoning one's responsibilities in the battle against COVID-19. Keep blaming others or saying that all are the policies' faults have little effect in making the situation better. Furthermore, each country or region should design its anti-pandemic strategy with reference to its context. In terms of policy advice, we need to avoid falling into meaningless comparisons.
While facing the internal desire to criticize, we should all learn to restrain ourselves. This does not mean self-censorship, rather, bear in mind that criticism may not bring forward any contribution at all. From the perspective of fighting COVID-19 together, self-reflection encourages people to turn their focus, from finding fault with others to discovering one's potential, by thinking in what they can follow the example of front liners. If you think something is wrong with the current anti-pandemic work, apart from passively commenting on their limits and the possible causes, you may also actively participate in it, thereby improving the quality of work with your own efforts.
Be grateful
Although the end of the pandemic has not been seen yet, a considerable number of people are still willing to dedicate their time and effort to the work against COVID-19 in their respective cities. In addition to the city-wide passion and the sense of mission, such willingness is also backed by the factor of gratitude.
At the local level, taking Hong Kong as an example, ""Hong Kong Volunteers Against Coronavirus"", political party teams and civil organizations have taken an active role in supporting and caring for the local community. At the national level, Chinese people always have the spirit of ""when one place suffers misfortune, help comes from all quarters"". When Hong Kong suffered from the serious challenge of the fifth wave of COVID-19, the mainland immediately offered its support without hesitation, for instance, manpower in testing service, food supply and assistance in building ""fangcang hospitals""(makeshift hospitals).
The recent outbreak of COVID-19 in Shanghai drew nationwide attention as well. In response, multiple provinces have lent a hand to the city. At the international level, the World Health Organization advocates the idea of sharing vaccines with those in need, and some of the countries are willing to undertake more missions in international aid.
Despite no professional training in the medical field, we can still devote ourselves to community services, and packing, delivering or distributing anti-pandemic materials can be a good start. Individuals may seem trivial on many occasions, however, remember that society is built on the unity of each ""trivial"" person. When everyone in society is willing to take a step forward, each tiny output will gradually gather into a mighty force. Together, we shall conquer.
The author is a PhD student at the University of Hong Kong.
The opinions expressed here are those of the writer and do not necessarily represent the views of China Daily and China Daily website.
If you have a specific expertise, or would like to share your thought about our stories, then send us your writings at opinion@chinadaily.com.cn , and comment@chinadaily.com.cn",COVID CORONAVIRUS (93%); COVID-19 CORONAVIRUS (93%); EPIDEMICS (90%); INFECTIOUS DISEASE (90%); PUBLIC HEALTH (90%); EPIDEMIOLOGY (89%); PANDEMICS (89%); COVID-19 CORONAVIRUS REGULATION & POLICY (78%); SOCIAL DISTANCING (78%); NEGATIVE PERSONAL NEWS (77%); NEGATIVE NEWS (76%); INVESTIGATIONS (73%); PERSONAL PROTECTIVE EQUIPMENT (73%); STATISTICS (73%); VACCINES (73%); REGIONAL & LOCAL GOVERNMENTS (70%); EMOTIONS (67%); INTERNATIONAL ECONOMIC ORGANIZATIONS (65%); GOVERNMENT & PUBLIC ADMINISTRATION (55%)
2022-04-12,"Confronting COVID-19 with humility, reflection and gratitude",China Daily,401,"By DU JUAN | China Daily | Updated: 2022-03-09 09:43
Beijing is facing a severe and complicated COVID-19 epidemic control and prevention situation, with seven new locally transmitted cases reported between Monday and 4 pm Tuesday, a senior official said, adding that the patients include a family cluster.
As COVID-19 outbreaks are still hitting many areas in China and overseas, Beijing is facing a severe prevention and control situation, with the major threat from outside the capital, Xu Hejian, a spokesman for the Beijing municipal government, said at a news conference on Tuesday afternoon.
""The authorities should tighten measures on people returning to Beijing from other areas in the country so that a 48-hour valid negative nucleic acid testing result and green health code are both required on arrival,"" he said. ""All companies in Beijing should strictly follow the prevention and control measures involving group events, meetings and training classes. Video conferences are recommended for such activities.""
Three of the seven new locally transmitted cases are in the capital's Haidian district and four in its Chaoyang district, said Pang Xinghuo, deputy director of the Beijing Center for Disease Control and Prevention.
The four cases in Chaoyang are from one family &ndash; an elder sister, a younger brother, their mother and great-grandmother.
Health authorities in Chaoyang triggered an emergency response mechanism, launched an epidemiological investigation and a nucleic acid testing campaign, and placed areas involved under strict control after the two children tested positive for COVID-19 in a preliminary screening.
The Chaoyang district government was notified by the disease control and prevention center in Beijing's Tongzhou district on Monday after the two children, who live in Chaoyang, tested positive for the novel coronavirus at Tongzhou Maternal and Child Health Care Hospital.
The three cases in Haidian include a married couple. The husband returned from Shanghai on China Eastern Airlines' flight MU5121 on Feb 27.
The other patient in Haidian developed a fever on Sunday and arrived at a local hospital on Monday, where a nucleic acid test confirmed they were infected.
The municipal health authority has released details of the movements of all the patients and has asked residents to report to their local communities if they have been to the same places at the same time.","COVID CORONAVIRUS (91%); COVID-19 CORONAVIRUS (91%); EPIDEMIOLOGY (91%); PUBLIC HEALTH (91%); COMMUNICABLE DISEASE CONTROL (90%); INFECTIOUS DISEASE (90%); PUBLIC HEALTH ADMINISTRATION (90%); DISEASES & DISORDERS (89%); EPIDEMICS (89%); PREVENTION & WELLNESS (89%); REGIONAL & LOCAL GOVERNMENTS (89%); PRESS CONFERENCES (78%); CHILDREN'S HEALTH (77%); COMMUNITY HEALTH PROGRAMS (77%); CORONAVIRUSES (77%); DISEASE REPORTING (77%); INVESTIGATIONS (77%); MARRIAGE (76%); CITY GOVERNMENT (75%); NEGATIVE PERSONAL NEWS (75%); TALKS & MEETINGS (75%); HEALTH DEPARTMENTS (72%); VIRUSES (72%); CITIES (70%); GOVERNMENT & PUBLIC ADMINISTRATION (70%)

Company:  CHINA EASTERN AIRLINES CORP LTD (80%)

Ticker: K3CD (SGX) (80%); CEA (NYSE) (80%); 0670 (HKSE) (80%)"
