date,title,section,body,subject,length,source
2022-09-30,UK is only G7 country with smaller economy than before Covid-19,BUSINESS; Version:2,"Whenever a new Covid-19 outbreak occurs in Australia, we hear a lot about daily case numbers and hotspots, but we rarely hear about those diagnosed with the virus and what happens to them.
In Australia, there are more than 450 active cases and nearly 40,000 since the start of the pandemic. The figure is small compared with other countries and a tiny proportion of the hundreds of thousands of close contacts who were potentially exposed.
But what happens if you are among the few to have been at an exposure site , develop symptoms, get tested and find out you are positive? If your symptoms are not severe, can you ride the illness out at home? What if you live alone and can't go out to buy food? And how long do you have to wait before you can safely go back into the community?
                   Do you have to go to hospital?                   
There are national guidelines for treating Covid cases , and these guidelines have been updated several times throughout the course of the pandemic. However, states do differ in their approach to patients.
Queensland does not allow home isolation, even for mild cases, and even for people who live alone. If someone tests positive they are transferred by ambulance to a Covid-19 ward at one of five hospitals across the state; Cairns hospital, Sunshine Coast University hospital, Gold Coast hospital, Royal Brisbane Women's hospital or the Prince Charles hospital.
Exceptions are made for children who test positive. In those cases, their parent or carer will receive a call from the local public health unit who will tell them what to do next. The child will need to stay at home in self-isolation until they recover. If they get sicker, they may be admitted to hospital.
Like Queensland, Western Australia does not allow home isolation with Covid and people must stay in a quarantine hotel.
NSW Health, on the other hand, interviews and assesses people who test positive to decide where a person is best managed - at home, or in hospital. Those who test positive are monitored on a regular basis by a member of the public health unit, even if they are at home.
There is also Special Health Accommodation, known as medi-hotels in other states, which are used for those who become ill in hotel quarantine. These facilities are also used to accommodate members of the community who can't isolate from others at their home, or who are vulnerable and need extra support.
In Victoria, a Department of Health spokeswoman said care is ideally provided in the home through telehealth, though serious cases go to hospital.
The national guidelines say symptoms should be used to help state health departments decide whether a Covid-positive person is best managed in hospital, at home or other settings such as a medi-hotel.
Cases should only be managed at home if they live in a low-risk setting, and consideration is given to whether vulnerable people live in the home as well. If the state or territory health department can be confident that the infected person can be kept separate from other people in the home - for example they have their own bedroom, bathroom and means of getting food without using a communal kitchen - then a positive case may be able to isolate at home.
The case and their household contacts will then be counselled about risk, and infection control measures. Department of Health staff also have to be confident that everyone in the household will comply with directions.
                   What support is offered?                   
In each state, those who test positive are monitored on a regular basis by public health staff who call or text to check in, and are provided with healthcare, which includes mental health support. This is facilitated by the state's public health unit.
States and territories also offer support for those who live alone, or who are struggling to make ends meet due to being unable to work because of isolating due to Covid-19.
For example, in Victoria  people who need to quarantine or isolate and don't have enough food to feed themselves or their families may be eligible to receive an emergency relief package of basic supplies. Support can be accessed by calling the Covid-19 information line in each state or territory.
""After a person receives a positive test result, they will receive a call from a local health service that will provide information about the Covid-19 positive care pathways program, which aims to give all people with Covid-19 access to high quality care and support at the right time and in the right setting,"" a Victorian department of health spokeswoman said.
There is no approved treatment for mild cases of Covid-19 and, in most cases, symptoms will resolve on their own. If you need access to medicines for other medical conditions while isolating with and recovering from Covid-19, you can still arrange telehealth appointments with your GP and many pharmacies can assist  you to have prescriptions delivered to your home.
                   When can I leave isolation?                   
Revisions to the release from isolation criteria have been made due to the significant increase in the number of people in Australia infected with variants of concern, including the Delta variant. 
There are a number of conditions in which someone might be released by the local public health unit, including;
                                                               If at least 14 days have passed since the first positive test for Covid-19 was taken and no symptoms have developed during this period.                                                                 If at least 14 days have passed since the onset of symptoms, and there has been resolution of fever and substantial improvement of respiratory symptoms over the previous 72 hours.                                                                 If there are still symptoms, but at least 20 days have passed since the onset of those symptoms, and the person is not significantly immunocompromised.                                                           
There are slightly higher criteria immunocompromised people have to meet before being released, including returning at least two consecutive negative Covid-19 tests 24 hours apart a week after the onset of symptoms, as well as meeting the criteria in the first two bullet points.
A spokeswoman for Victoria's health department said: ""As the individual reaches the end of the isolation period, the department of health will check if the person has experienced any symptoms in the past 72 hours. If so, their isolation period will be extended. If not, the individual will be cleared from isolation.""
A NSW Health spokeswoman said a person can return to daily activities after they leave self-isolation but should continue to practice good hygiene and physical distancing.
""If they develop Covid-19 symptoms at any point after their isolation period, they should get tested immediately and self-isolate until they receive a negative result,"" the spokeswoman said.","COVID CORONAVIRUS (94%); COVID-19 CORONAVIRUS (92%); PUBLIC HEALTH (91%); CORONAVIRUSES (90%); EPIDEMICS (90%); INFECTIOUS DISEASE (90%); PANDEMICS (90%); VACCINES (90%); VIRUSES (90%); HEALTH DEPARTMENTS (89%); ISOLATION & QUARANTINE (89%); PUBLIC HEALTH ADMINISTRATION (89%); DISEASES & DISORDERS (78%); TELEMEDICINE (77%); FOOD SAFETY REGULATION (74%); TELEHEALTH (68%)

Industry: VACCINES (90%); HEALTH DEPARTMENTS (89%); HOTELS & MOTELS (87%); TELEMEDICINE (77%); FOOD SAFETY REGULATION (74%); HOSPITALS (73%); EMERGENCY VEHICLES (68%); MATERNITY HOSPITALS (68%); TELEHEALTH (68%)",1165,The Guardian (London)
2021-07-06,What happens if you're diagnosed with Covid-19 in Australia?,AUSTRALIA NEWS; Version:2,"The National Hockey League will not send its players to compete in the men's ice hockey tournament at the Beijing Olympics due to Covid-19 concerns as the highly transmissible Omicron variant of the coronavirus spreads globally, ESPN reported on Tuesday.
The NHL agreed last September to pause its regular season so the world's top players could compete in Beijing with the caveat it could withdraw if Covid-19 disruptions forced games to be rescheduled during the Olympics window.
That had begun looking increasingly likely in recent days with the NHL being forced to postpone 50 games in Canada and the United States after a growing number of players entered Covid-19 protocols while Omicron tore through professional sports leagues with fully vaccinated players testing positive.
The NHL did not immediately respond to a request for comment. ESPN said a formal announcement on opting out of the Beijing Games was expected within the next 24 hours.
The NHL had until 10 January to withdraw from the Beijing Olympics, scheduled for 4-20 February, without financial penalty.
Players had mostly been eager to return to the largest international stage. But concerns that a positive test in China could lead to a 21-day quarantine and delay returning to their families and NHL clubs had dampened that enthusiasm for some.
""Obviously, it's unsettling if that were to be the case when you go over there,"" Edmonton Oilers star Connor McDavid, who was expected to be a top player for Canada, said last week.
NHL commissioner Gary Bettman said in early December that the decision on participating in Beijing would ultimately come down to the players, but added that the league's concerns had ""only been magnified"" by the Covd-19 outbreak.
The NHL, unhappy over the prospect of interrupting a regular season to send their most valuable assets overseas where they could get hurt, ended a run of participation in five consecutive Winter Olympics when it decided not to go to Pyeongchang in 2018.
The presence of NHL players at the Olympics made the men's ice hockey tournament one of the marquee events of the global sporting showcase.
Their absence will have an impact on the Canadian and US teams the most, given their entire Olympic hockey rosters would be made up of NHL players. Other medal contenders like Sweden, Finland, Russia and the Czech Republic are somewhat less dependent on NHL talent.
The Washington Capitals-Philadelphia Flyers game scheduled for Tuesday night became 50th NHL game delayed this season for coronavirus-related reasons.
The league said Covid-19 issues with the Capitals prompted the postponement. Defenseman Justin Schultz and forward Daniel Sprong began the team's morning skate in Philadelphia but were pulled off after their test results came back.
Wiping out Capitals-Flyers left the Tampa Bay Lightning at the Vegas Golden Knights as the only game left in the NHL this week. The league and players' association agreed to begin the annual holiday break early and push off the games that were scheduled for Thursday.
""It's not fun to see all these games getting canceled,"" Lightning defenseman Victor Hedman said. ""It'll be interesting to see the make-up dates and when they're going to fit those games in, but for us to focus on that, we can't do that.""","COVID CORONAVIRUS (96%); COVID-19 CORONAVIRUS (96%); SPORTS & RECREATION (93%); WINTER SPORTS (92%); OLYMPICS (91%); SPORTS & RECREATION EVENTS (91%); WINTER OLYMPICS (91%); DELAYS & POSTPONEMENTS (90%); ICE HOCKEY (90%); INFECTIOUS DISEASE (90%); MEN'S SPORTS (90%); PROFESSIONAL SPORTS (90%); SUMMER OLYMPICS (90%); TOURNAMENTS (89%); SPORTS COMMISSIONERS (79%); CORONAVIRUSES (77%); VIRUSES (77%); COVID-19 CORONAVIRUS REGULATION & POLICY (73%); ISOLATION & QUARANTINE (73%); VACCINES (73%); FINES & PENALTIES (52%)

Organization: NATIONAL HOCKEY LEAGUE (94%); EDMONTON OILERS (93%); DALLAS STARS (91%)

Industry: VACCINES (73%)",544,The Guardian (London)
2021-12-21,NHL will not send players to Beijing Winter Olympics due to Covid-19,SPORT; Version:1,"The US has declared its support for a patent waiver on Covid-19 vaccines  to boost their production and distribution around the world.
The waiver will not take place immediately as it has to be approved by consensus at the World Trade Organization (WTO), but the decision of the Biden administration to throw its weight behind a waiver will have a strong influence on the outcome of that decision.
""This is a global health crisis,"" Katherine Tai, the US trade representative, said in a written statement. ""The extraordinary circumstances of the Covid-19 pandemic call for extraordinary measures.
""The administration strongly believes in intellectual property protections, but in service of ending this pandemic, supports the waiver of those protections for Covid-19 vaccines. We will actively participate in text-based negotiations at the WTO needed to make that happen.""
The announcement was quickly welcomed by the head of the World Health Organization, Tedros Adhanom Ghebreyesus, who described it as a ""monumental moment in the fight against Covid-19"" and a ""powerful example of American leadership to address global health challenges"".
""Now let's all move together swiftly, in solidarity, building on the ingenuity and commitment of scientists who produced life-saving Covid-19 vaccines,"" he said.
The decision was announced during a two-day WTO meeting. India and South Africa have been backing a waiver proposal since October, with the support of about 100 emerging economies, but wealthy countries have been blocking a debate on the issue at the WTO's Trade-Related Aspects of Intellectual Property Rights (Trips) council.
There is still resistance to a patent waiver in the European Union and Switzerland. A meeting of G7 foreign ministers in London  failed to agree on a common position on the issue. A G7 action plan called for greater funding for a UN-administered distribution scheme, Covax, and for voluntary licensing and technology transfer agreements.
Opponents of the waiver within the administration had argued it was not the main bottleneck on production and distribution and that its approval could have a chilling effect on incentives for pharmaceutical companies to produce rapid vaccines in the future. Proponents argued it was an essential move towards greater equity in vaccine distribution and a test of US leadership under Joe Biden's leadership.
At present, one in four people in rich countries have received at least one vaccine dose. In low-income nations, the ratio is about one in 500 people. ""Adoption of this waiver is critical to disseminate vaccine technology to middle-income and low-income nations, so that all people around the world can get access to vaccines and treatment, as quickly as possible,"" Paul O'Brien, the executive director of Amnesty International USA, said.
""By reversing the prior administration's position, President Biden has made clear that the US prioritises people's lives over pharmaceutical company profits.""","COVID CORONAVIRUS (94%); COVID-19 CORONAVIRUS (94%); VACCINES (92%); ASSOCIATIONS & ORGANIZATIONS (91%); INTERNATIONAL ECONOMIC ORGANIZATIONS (91%); APPROVALS (90%); EPIDEMICS (90%); INFECTIOUS DISEASE (90%); INTERNATIONAL TRADE (90%); PANDEMICS (90%); INTELLECTUAL PROPERTY (89%); PATENTS (89%); INTERNATIONAL ASSISTANCE (85%); AGREEMENTS (78%); CORONAVIRUSES (78%); HEALTH DEPARTMENTS (78%); HUMAN RIGHTS VIOLATIONS (78%); INTELLECTUAL PROPERTY LAW (78%); TECHNOLOGY TRANSFER (78%); US PRESIDENTIAL CANDIDATES 2016 (78%); US PRESIDENTIAL CANDIDATES 2020 (78%); VIRUSES (78%); EMERGING MARKETS (76%); STATE DEPARTMENTS & FOREIGN SERVICES (76%); PUBLIC HEALTH ADMINISTRATION (75%); TALKS & MEETINGS (75%); INTERNATIONAL RELATIONS & NATIONAL SECURITY (73%); TRADE DEVELOPMENT (73%); UNITED NATIONS INSTITUTIONS (72%); EXECUTIVES (71%); INTERNATIONAL RELATIONS (71%); EUROPEAN UNION (62%); GOVERNMENT ADVISORS & MINISTERS (62%); MIDDLE INCOME PERSONS (60%); ECONOMY & ECONOMIC INDICATORS (50%)

Organization: WORLD TRADE ORGANIZATION (93%); WORLD HEALTH ORGANIZATION (56%)

Industry: VACCINES (92%); DRUG AVAILABILITY (78%); HEALTH DEPARTMENTS (78%); PHARMACEUTICALS & BIOTECHNOLOGY (78%); PHARMACEUTICALS INDUSTRY (78%); PHARMACEUTICALS TRADE (78%); MEDIA & TELECOMMUNICATIONS (73%); PHARMACEUTICAL PREPARATION MFG (50%)",493,The Guardian (London)
2021-05-05,US declares support for patent waiver on Covid-19 vaccines,WORLD NEWS; Version:3,"As Covid-19 infections surge in England people are increasingly reporting catching SARS-CoV-2 for a second or even third time. New analysis has suggested that unvaccinated individuals should expect to be reinfected with Covid-19 every 16 months, on average.
With winter approaching, scientists are warning that such reinfections could add to the burden on the NHS, some calling for the vaccination programme to be extended to all schoolchildren, including two doses for teenagers.
""If you've got high-level prevalence, and frequent exposure to the virus, as you have in schools, you are going to see more and more people getting reinfected despite having been double vaccinated,"" said Stephen Griffin, associate professor of virology at the University of Leeds.
This time last year the assumption was that although reinfections could occur this was relatively uncommon , with only two dozen or so recorded worldwide. We now know that natural immunity to SARS-CoV-2 begins to dwindle over time. One Danish study  suggested that the under-65s had about 80% protection for at least six months, while the over-65s had only 47% protection.
The arrival of the Delta variant has further complicated the situation. ""Certainly in the healthcare workers that we've been studying there are many people who had moderately decent levels of antibodies who have been, in some cases, previously infected and double-dose vaccinated, who have gone down with symptomatic infections. I think it is far more common than the kinds of numbers we were used to before,"" said Danny Altmann, professor of immunology at Imperial College London.
According to ONS data  published on 6 October among 20,262 Britons who tested positive for Covid-19 between July 2020 and September 2021, there were 296 reinfections - defined as a new positive test 120 days or more after an initial first positive test - with an average (median) time of 203 days between positive tests. 
However, the reinfection risk appears to have been higher since May 2021 when Delta took over as the predominant variant.
Further data from the US, where various states have now started tracking and reporting on reinfection rates, supports the idea there is a substantially higher risk of re-infection with Delta. 
In Oklahoma , which has a population of about 3.9 million, there were 5,229 reinfections reported during September (equivalent to a reinfection rate of 1,152 per 100,000) and reinfections have risen 350% since May. The US Centres for Disease Control and Prevention (CDC) defines reinfection as a lab-confirmed case of Covid-19 occurring 90 days or more after a previously lab-confirmed case.
Dr Nisreen Alwan, associate professor in public health, at the University of Southampton, said: ""With rising levels of SARS-CoV-2 infections in the UK, many of us are personally aware of children and adults who got reinfected, sometimes after a relatively short period from their first infection. We still don't know much about the risk factors for reinfection but the theoretical assumption that once all the young get it the pandemic will be over is becoming increasingly unlikely.""
To help answer this question, Prof Jeffrey Townsend, at Yale University School of Medicine, in New Haven, in the US, and colleagues, analysed known reinfection and immunological data from other coronaviruses, including those that cause SARS, MERS and common colds. By combining this with antibody and other immunological data from people who had recovered from SARS-CoV-2, they were able to model the risk of Covid-19 reinfection over time.
The research, published in The Lancet Microbe , suggested that reinfections would become increasingly common as immunity waned, particularly when the number of infections was high. ""If we had no infection controls, no one was masking or social distancing, there were no vaccines, we should expect reinfection on a three-month to five-year timescale - meaning that the average person should expect to get Covid every three months to five years,"" Townsend said.
Although vaccines are suppressing the level of infections, the UK reported 49,156 Covid cases on Monday, the highest figure since mid-July. Rates are highest among secondary schoolchildren, with an estimated 8.1% of this group thought to have had Covid-19 in the week ending 9 October.
""If you allow it to run amok in any age group then it runs amok in all age groups,"" said Townsend. ""The major implications are that if you haven't been vaccinated, you should get vaccinated, and if you've been infected, you should go ahead and get vaccinated anyway, because that will extend the duration of your protection.""
Griffin said: ""If you don't clamp down on prevalence [in schoolchildren] you'll get the spread of infection and possibly reinfection, which will then potentially spread to parents whose vaccines may be waning, and more critically to grandparents and clinically vulnerable people.""","COVID-19 CORONAVIRUS (96%); COVID CORONAVIRUS (95%); VACCINES (92%); CORONAVIRUSES (91%); CHILDREN (90%); INFECTIOUS DISEASE (90%); SCIENCE & TECHNOLOGY (90%); STUDENTS & STUDENT LIFE (90%); VIRUSES (90%); EPIDEMIOLOGY (89%); PUBLIC HEALTH (89%); SARS (89%); COLLEGE & UNIVERSITY PROFESSORS (88%); COMMUNICABLE DISEASE CONTROL (78%); DISEASE IMMUNITY (78%); DISEASES & DISORDERS (78%); HEALTH CARE PROFESSIONALS (78%); IMMUNOLOGY (78%); MICROBIOLOGY (78%); PREVENTION & WELLNESS (78%); PUBLIC HEALTH ADMINISTRATION (78%); VACCINATION & IMMUNIZATION (78%); VIROLOGY (78%)

Industry: VACCINES (92%); EPIDEMIOLOGY (89%); COLLEGE & UNIVERSITY PROFESSORS (88%); HEALTH CARE PROFESSIONALS (78%); IMMUNOLOGIC FACTORS (78%); IMMUNOLOGY (78%); VACCINATION & IMMUNIZATION (78%); VIROLOGY (78%); MEDIA & TELECOMMUNICATIONS (73%)",818,The Guardian (London)
2021-10-19,Without Covid-19 jab 'reinfection may occur every 16 months' say scientists,WORLD NEWS; Version:1,"How did Covid-19 begin? Some propose a ""lab-leak"" hypothesis, according to which Chinese virologists working on ways to make bat coronaviruses more dangerous to humans did all too well at that and then let it escape. Others think it more likely that, like many other diseases, Covid-19 is naturally ""zoonotic"". What?
                     Zoon is the ancient Greek for ""animal"", hence ""zoologist"" and, um, ""zoo"". Nosos, meanwhile, is the Greek for ""disease"", hence many artful English coinages that have long since, alas, fallen into desuetude, such as ""nosography"" (17th century), the systematic description of illness (literally ""writing about disease""), or ""nosotrophous"", disease-causing. A disease that is ""zoonotic"", then, is one that has jumped the species barrier from another animal to flourish in humans, such as bird flu and swine flu, but also HIV (from chimpanzees), toxoplasmosis (cats), anthrax (cattle) and rabies (dogs). 
The technical medical lexicon, happily, still includes the term ""nosology"" (from 1721, defined then by lexicographer Nathan Bailey as ""a Treatise concerning Diseases""): it now means either the systematic classification of maladies, or the state of knowledge about one particular disease. Thus, the question of whether Covid-19 is zoonotic must await further nosological developments.
                      Steven Poole's A Word for Every Day of the Year is published by Quercus.",,238,The Guardian (London)
