date,title,section,body,subject,length,source
2021-04-21,Dementia deaths in Australia fell during Covid-19 pandemic,AUSTRALIA NEWS; Version:2,"A Boston-area hospital said it will not perform a heart transplant on a patient who refuses to get a Covid-19 vaccination.
DJ Ferguson, 31, was previously prioritized for a heart transplant at Brigham and Women's hospital, but is no longer eligible as he refuses to get vaccinated, said Ferguson's family, according to a report by CBS Boston.
""It's kind of against his basic principles - he doesn't believe in it,"" said David Ferguson, his father. ""It's a policy they are enforcing and so, because he won't get the shot, they took him off the list [for] a heart transplant.""
Brigham and Women's explained its reasoning in a statement: ""Like many other transplant programs in the United States - the Covid-19 vaccine is one of several vaccines and lifestyle behaviors required for transplant candidates in the Mass General Brigham system in order to create both the best chance for a successful operation and also the patient's survival after transplantation.""
Other medical experts have declared their support of the hospital's policy, noting that the immune system is extremely weak after a transplant, making vaccinations all the more important.
""Post any transplant, kidney, heart whatever, your immune system is shut off. The flu could kill you, a cold could kill you, Covid could kill you,"" said Dr Arthur Caplan, the head of medical ethics at NYU Grossman School of Medicine, told CBS Boston.
""The organs are scarce: we are not going to distribute them to someone who has a poor chance of living when others who are vaccinated have a better chance post-surgery of surviving.""
Ferguson's family have said they are unsure of what to do next given his refusal to receive the Covid-19 vaccine. They have considered transferring him to a different facility but acknowledge he might not survive the trip.
""We are aggressively pursuing all options, but we are running out of time,"" said David Ferguson.
The family said that while had received excellent care at Brigham and Women's, they do not agree with the policy.
""I think my boy is fighting pretty damn courageously, and he has integrity and principles he really believes in, and that makes me respect him all the more,"" said Ferguson of his son, who is a father of two children with another one on the way. ""It's his body. It's his choice.""","TRANSPLANT SURGERY (96%); VACCINES (96%); COVID CORONAVIRUS (92%); COVID-19 CORONAVIRUS (92%); DISEASE IMMUNITY (90%); INFECTIOUS DISEASE (90%); VACCINATION & IMMUNIZATION (90%); HEART DISEASE (89%); ANTI-VACCINE MOVEMENT (78%); ETHICS (78%); SOCIETY, SOCIAL ASSISTANCE & LIFESTYLE (78%); SURGERY & TRANSPLANTATION (78%); HUMAN SUBJECTS (73%); INFLUENZA (73%); MEDICAL ETHICS (73%)

Industry: VACCINES (96%); MATERNITY HOSPITALS (90%); VACCINATION & IMMUNIZATION (90%); ACADEMIC MEDICAL CENTERS (89%); ANTI-VACCINE MOVEMENT (78%)",380,The Guardian (London)
2022-01-25,Patient removed from heart transplant list for refusing Covid-19 vaccine,US NEWS; Version:1,"Barack Obama has tested positive for Covid-19.
""I just tested positive for Covid,"" the former president, 60, said in a tweet  on Sunday.
""I've had a scratchy throat for a couple days, but am feeling fine otherwise. Michelle and I are grateful to be vaccinated and boosted, and she has tested negative. It's a reminder to get vaccinated if you haven't already, even as cases go down.""
Falling case rates in the US have triggered the relaxation of most public health measures imposed by cities, states and the federal government.
There were roughly 35,000 infections on average over the past week, down sharply from mid-January when the average was closer to 800,000.
According to Johns Hopkins University , the US death toll from the two-year coronavirus pandemic  stood on Sunday at a little over 967,000, from nearly 79.5m cases.
According to the federal Centers for Disease Control and Prevention (CDC), 75.2% of US adults are fully vaccinated and 47.7% of the fully vaccinated have received a booster. 
The CDC relaxed its guidelines for indoor masking in late February, taking a more holistic approach that meant the vast majority of Americans live in areas without the recommendation for indoor masking in public.
Resistance to vaccination and other public health measures against Covid is higher in Republican-run states.
The Obamas have homes in Washington DC, Massachusetts and Hawaii, all with more than 70% of the eligible population considered fully protected.
Last August, however, Obama was forced to drastically scale back  a 60th birthday party he planned to host on Martha's Vineyard, an exclusive Massachusetts island, amid criticism for planning a large social event at a time of surging cases.
                                                                                        The Associated Press contributed to this report","COVID CORONAVIRUS (96%); COVID-19 CORONAVIRUS (92%); PUBLIC HEALTH (91%); US PRESIDENTIAL CANDIDATES 2008 (91%); EPIDEMIOLOGY (90%); INFECTIOUS DISEASE (90%); PUBLIC HEALTH ADMINISTRATION (90%); US PRESIDENTIAL CANDIDATES 2012 (90%); VACCINES (90%); PANDEMICS (78%); VACCINATION & IMMUNIZATION (78%); DISEASES & DISORDERS (77%); EPIDEMICS (77%); DEATH RATES (75%); HEALTH DEPARTMENTS (75%); PREVENTION & WELLNESS (75%); US FEDERAL GOVERNMENT (75%); GOVERNMENT & PUBLIC ADMINISTRATION (73%); CORONAVIRUSES (71%); VIRUSES (70%); DEATH & DYING (69%); TRENDS & EVENTS (63%)

Company:  ASSOCIATED PRESS (51%)

Organization: JOHNS HOPKINS UNIVERSITY (55%); CENTERS FOR DISEASE CONTROL & PREVENTION (54%)

Industry: SIC7383 NEWS SYNDICATES (51%); EPIDEMIOLOGY (90%); VACCINES (90%); VACCINATION & IMMUNIZATION (78%); HEALTH DEPARTMENTS (75%); PRESS AGENCY RELEASES (73%)

Person: BARACK OBAMA (89%); MICHELLE OBAMA (79%)",319,The Guardian (London)
2022-03-13,Barack Obama announces positive test for Covid-19,US NEWS; Version:3,"AstraZeneca boss Pascal Soriot has called on the government to provide access to its Covid-19 medicine Evusheld, saying it's a ""sad situation"" that Britain is one of the few developed nations not to have ordered the drug, designed for those with poor immune systems.
His comments came as the company flagged declining sales of its Covid vaccine, developed with the University of Oxford. Strong performances by other medicines for cancer, diabetes and other conditions catapulted overall sales 60% higher to $11.4bn in the first three months of the year, despite the pandemic affecting cancer diagnosis rates.
Last month the firm received UK regulatory approval  for its long-acting Covid-19 antibody treatment Evusheld , in a boost to its coronavirus portfolio. Aimed at preventing Covid infections in immunocompromised people who cannot be vaccinated, Evusheld had already been approved in the US, France and other countries, and the US government has ordered 1.7m doses. 
It is a combination of two long-acting antibodies that works by binding to the spike protein on the virus's membrane that causes Covid-19, preventing it from attaching to and entering human cells.
""The UK is probably one of the rare developed countries in the world that has not ordered Evusheld. It's a sad situation, quite frankly, because people who are immune-compromised are really suffering from the Covid crisis,"" Soriot said, adding they were at greater risk now that Covid restrictions have been lifted.
""They also represent a pretty large proportion of the people who are hospitalised for Covid, so they do need access to this medicine.""
The Anglo-Swedish drugmaker made sales of $1.1bn from the Covid jab between January and March, and $469m from Evusheld. It has moved away from not-for-profit pricing in new Covid vaccine contracts, but insists that it still supplies it at affordable rates. It reiterated that revenues from the jab are set to decline in coming quarters.
Soriot explained: ""We are no longer in a period of scarcity of vaccine supply. We have oversupply everywhere in the world, so what's out there needs to be used, and then we'll be able to get a better sense for reordering.""
He said the vaccine had shown itself to be a ""very strong booster"". The jab has not yet received approval in the US, and Soriot said the company remains in discussions with the US regulator, and hopes to wrap these up soon.","COVID CORONAVIRUS (94%); COVID-19 CORONAVIRUS (94%); DISEASE IMMUNITY (90%); INFECTIOUS DISEASE (90%); VACCINES (90%); CANCER (79%); CANCER DRUGS (79%); DRUG DESIGN & DISCOVERY (79%); NEGATIVE BUSINESS NEWS (79%); COVID-19 CORONAVIRUS REGULATION & POLICY (78%); PUBLIC HEALTH (78%); NEGATIVE NEWS (77%); SUPPLY CHAIN DISRUPTIONS (77%); BIOLOGICS MFG (76%); EPIDEMICS (76%); VIRUSES (76%); CORONAVIRUSES (75%); APPROVALS (74%); DIABETES (56%)

Company:  ASTRAZENECA PLC (92%);  TALLGRASS ENERGY CORP (53%)

Ticker: AZN (STO) (92%); AZN (NYSE) (92%); AZN (LSE) (92%)

Industry: NAICS325412 PHARMACEUTICAL PREPARATION MANUFACTURING (92%); SIC2834 PHARMACEUTICAL PREPARATIONS (92%); NAICS211130 NATURAL GAS EXTRACTION (53%); NAICS211120 CRUDE PETROLEUM EXTRACTION (53%); SIC1321 NATURAL GAS LIQUIDS (53%); SIC1311 CRUDE PETROLEUM & NATURAL GAS (53%); PHARMACEUTICALS INDUSTRY (91%); IMMUNOLOGIC FACTORS (90%); PHARMACEUTICALS & BIOTECHNOLOGY (90%); VACCINES (90%); DRUG AVAILABILITY (89%); CANCER DRUGS (79%); DRUG DESIGN & DISCOVERY (79%); BIOLOGICS MFG (76%); MEDIA & TELECOMMUNICATIONS (74%); PHARMACEUTICAL PREPARATION MFG (73%)",399,The Guardian (London)
2022-04-29,AstraZeneca head calls for UK to provide new Covid-19 medicine to the vulnerable,BUSINESS; Version:1,"Covid-19  infections in California are on the rise, as public health officials in the US west warn  that the more transmissible Delta variant of the coronavirus is fast gaining ground.
For the week-long period ending Tuesday, California saw an average of approximately 1,143 new Covid-19 cases a day, up 30% from mid-June. The increase started shortly after California's reopening on 15 June , the Los Angeles Times reports. 
Covid-19 hospitalizations have also increased by 34% since the middle of June. As of Tuesday, there were 1,228 Covid patients in California hospitals, compared with 915 reported on 12 June. That is still far less than hospitalizations at the pandemic's peak, when hospital admissions totalled almost 22,000.
""This is the call to anyone who hasn't been vaccinated: get vaccinated,"" California's governor, Gavin Newsom, said during a press briefing Wednesday. ""What more evidence do you need?""
The increases reported in California come amid global concern over the threat posed by the Delta or B.1.617.2 variant. In the US, Covid-19 cases are rising  in nearly half of states, according to the US Centers for Disease Control and Prevention (CDC). The variant is already the dominant strain of Covid-19 in the country, accounting for more than 50% of all new US cases and up to 80% of cases in some regions.
Vaccinations administered in the US, including the Pfizer and Moderna jabs, have been shown to be effective against the Delta variant, but it poses serious risks to those who are unvaccinated.
Across California, the Delta variant accounts for 35.6% of specimens analyzed for variants as of 21 June - an increase from 5.6% in May, the state's public health department said.  In Marin county, 70% of Covid-19 cases are attributed to the variant, the county's public health officer, Dr Matt Willis, told  the local ABC affiliate.
In Los Angeles county, authorities said that the Delta variant comprised almost 50% of assessed Covid-19 cases, up from 5% one month prior, according to the Los Angeles Times. Health officials in the county, which battled a huge Covid-outbreak last winter, have recommended that everyone mask indoors, regardless of whether or not they are vaccinated.
Covid-19 case levels and hospitalizations across the state are still far lower than at the worst stages of the pandemic, despite the recent uptick. California's reported daily Covid-19 deaths are among the lowest in 15 months, averaging 18 deaths a day, a sweeping decline from a high of 537 daily deaths in the weeklong period that ended on 27 January. At present, 3.1 California residents are hospitalized with Covid-19 for every 100,000.
The best defense against the Delta variant is vaccination, and California's vaccination rate is among the highest in the US.
""Almost without exception, everybody that's getting hospitalized, the people who have lost their lives, have been hospitalized or lost their lives because they haven't been vaccinated - period, full stop,"" Newsom said.
While there have been some ""breakthrough"" cases, in which fully vaccinated persons contract Covid-19, the number is exceedingly small. It's not clear how many of those were the result of Delta variant. But multiple studies have shown that two vaccine doses are highly effective  at protecting against hospitalization from the Delta variant.
But disparities on who receives jabs in the state remain. Data from the Los Angeles county health department show  racial disparities in vaccination rates, with Black and Latino persons receiving vaccinations at lower rates. A California Healthline report  earlier this week also revealed that some of the state's rural regions lagged behind with vaccinations.","COVID-19 CORONAVIRUS (98%); COVID CORONAVIRUS (96%); PUBLIC HEALTH (93%); VACCINES (91%); EPIDEMIOLOGY (90%); HEALTH DEPARTMENTS (90%); INFECTIOUS DISEASE (90%); PUBLIC HEALTH ADMINISTRATION (90%); PUBLIC OFFICIALS (90%); COUNTIES (89%); EPIDEMICS (89%); PANDEMICS (89%); VACCINATION & IMMUNIZATION (79%); CORONAVIRUSES (78%); DISEASES & DISORDERS (78%); PREVENTION & WELLNESS (78%); VIRUSES (78%); PRESS CONFERENCES (73%)

Company:  LOS ANGELES TIMES (84%);  PFIZER INC (58%)

Organization: CENTERS FOR DISEASE CONTROL & PREVENTION (55%)

Ticker: PFZ (LSE) (58%); PFE (NYSE) (58%)

Industry: NAICS511110 NEWSPAPER PUBLISHERS (84%); SIC2711 NEWSPAPERS: PUBLISHING, OR PUBLISHING & PRINTING (84%); NAICS325414 BIOLOGICAL PRODUCT (EXCEPT DIAGNOSTIC) MANUFACTURING (58%); NAICS325412 PHARMACEUTICAL PREPARATION MANUFACTURING (58%); NAICS325411 MEDICINAL & BOTANICAL MANUFACTURING (58%); SIC2836 BIOLOGICAL PRODUCTS, EXCEPT DIAGNOSTIC SUBSTANCES (58%); SIC2834 PHARMACEUTICAL PREPARATIONS (58%); SIC2833 MEDICINAL CHEMICALS & BOTANICAL PRODUCTS (58%); VACCINES (91%); EPIDEMIOLOGY (90%); HEALTH DEPARTMENTS (90%); HOSPITALS (79%); VACCINATION & IMMUNIZATION (79%)

Person: GAVIN NEWSOM (79%)",614,The Guardian (London)
2021-07-08,Covid-19 infections rising in California as Delta variant gains ground,US NEWS; Version:1,"We all know that person who, despite their entire household catching Covid-19, has never tested positive for the disease. Now scientists have found an explanation, showing that a proportion of people experience ""abortive infection"" in which the virus enters the body but is cleared by the immune system's T-cells at the earliest stage meaning that PCR and antibody tests record a negative result.
About 15% of healthcare workers who were tracked during the first wave of the pandemic in London, England, appeared to fit this scenario.
The discovery could pave the way for a new generation of vaccines targeting the T-cell response, which could produce much longer lasting immunity, scientists said.
Leo Swadling, an immunologist at University College London and lead author of the paper, said: ""Everyone has anecdotal evidence of people being exposed but not succumbing to infection. What we didn't know is whether these individuals really did manage to completely avoid the virus or whether they naturally cleared the virus before it was detectable by routine tests.""
The latest study intensively monitored healthcare workers for signs of infection and immune responses during the first wave of the pandemic. Despite a high risk of exposure 58 participants did not test positive for Covid-19 at any point. However, blood samples taken from these people showed they had an increase in T-cells that reacted against Covid-19, compared with samples taken before the pandemic took hold and compared with people who had not been exposed to the virus at all. They also had increases in another blood marker of viral infection.
The work suggests that a subset of people already had memory T-cells from previous infections from other seasonal coronaviruses causing common colds, which protected them from Covid-19.
These immune cells ""sniff out"" proteins in the replication machinery - a region of Covid-19 shared with seasonal coronaviruses - and in some people this response was quick and potent enough for the infection to be cleared at the earliest stage. ""These pre-existing T-cells are poised ready to recognise SARS-CoV-2,"" said Swadling.
The study adds to the known spectrum of possibilities after exposure to Covid-19, ranging from escaping infection entirely to severe disease.
Alexander Edwards, associate professor in biomedical technology at the University of Reading, said: ""This study identifies [a new] intermediate outcome - enough virus exposure to activate part of your immune system but not enough to experience symptoms, detect significant levels of virus or mount an antibody response."" 
The finding is particularly significant because the T-cell arm of the immune response tends to confer longer lasting immunity, typically of years rather than months, compared with antibodies. Nearly all existing Covid-19 vaccines focus on priming antibodies against the vital spike protein that helps SARS-CoV-2 enter cells. These neutralising antibodies give excellent protection against severe illness. However, the immunity wanes over time and a potential weakness of spike-based vaccines is that this region of the virus is known to mutate.
By contrast, the T-cell response does not tend to fade as quickly and the internal replication machinery that it targets is highly conserved across coronaviruses, meaning a vaccine that also targeted this region would probably protect against new strains - and possibly even against entirely new pathogens.
""Insights from this study could be critical in design of a different type of vaccine,"" said Edwards. ""A vaccine that primes T-cell immunity against different viral protein targets that are shared between many different coronaviruses would complement our spike vaccines that induce neutralising antibodies. Because these are components within the virus, antibodies are less effective - instead, T-cells come into play.""","COVID CORONAVIRUS (94%); COVID-19 CORONAVIRUS (93%); CORONAVIRUSES (90%); DISEASES & DISORDERS (90%); EPIDEMICS (90%); IMMUNOLOGY (90%); INFECTIOUS DISEASE (90%); MEDICAL DIAGNOSTICS, SCREENING & TESTING (90%); PUBLIC HEALTH (90%); VIRUSES (90%); AMINO ACIDS, PEPTIDES & PROTEINS (89%); BIOCHEMISTRY (89%); DISEASE IMMUNITY (89%); SARS (89%); SCIENCE & TECHNOLOGY (89%); VACCINES (89%); BIOMEDICINE (78%); IMMUNODIAGNOSTICS (78%); MEDICAL TECHNOLOGY (78%); COLLEGES & UNIVERSITIES (74%); COMMON COLD (73%); COLLEGE & UNIVERSITY PROFESSORS (69%)

Industry: IMMUNOLOGY (90%); IMMUNOLOGIC FACTORS (89%); VACCINES (89%); IMMUNODIAGNOSTICS (78%); MEDICAL TECHNOLOGY (78%); COLLEGES & UNIVERSITIES (74%); COLLEGE & UNIVERSITY PROFESSORS (69%)",643,The Guardian (London)
2021-11-10,People testing negative for Covid-19 despite exposure may have 'immune memory',WORLD NEWS; Version:2,"Scores of severely ill Covid-19 sufferers survived because they were given the NHS's highest form of intensive care in which an artificial lung breathes for them, a study  has found.
Patients in the UK who underwent extracorporeal membrane oxygenation (ECMO) were more likely to survive than those who did not have the treatment, according to the research.
People whose breathing capacity had collapsed were more likely to stay alive if they had ECMO rather than only a spell on a mechanical ventilator.
That is the key finding of an analysis of 1,363 people treated for severe Covid using a ventilator in the UK in between March 2020 and February 2021. They included 243 who were taken by ambulance to either Guy's and St Thomas' or the Royal Brompton and Harefield hospital trust in London to try to save their lives using ECMO.
The other 1,120 were known as what doctors called ""perceived futility"" cases - those it was deemed inappropriate to put on ECMO because they were considered too old and sick to survive Covid, and ECMO was thought unlikely to change their outcome. Doctors also had to consider who would benefit most from the limited availability of artificial life support, which is costly and labour-intensive, at the two specialist centres.
The 243 were matched by computer analysis for their similarity of personal profile and symptoms with 206 of the 1,120 patients who did not receive ECMO to compare their outcomes.
The study, which has been published in the journal Intensive Care Medicine, found that 44% of the non-ECMO group died, while mortality was much lower among those who had the treatment at 26%.
During ECMO, blood is taken out of the unconscious patient's body, put into an oxygenator, has oxygen added and carbon dioxide removed, and is then reinserted into the patient. The hope is that the extra oxygen will improve patients breathing enough to help them pull through.
""ECMO had a substantial effect at saving lives in the UK. Lives were saved due to the significant effort on the part of NHS staff to ramp up ECMO provision to provide service for as many [patients] as possible,"" said Dr Luigi Camporota, a consultant in intensive care medicine at Guy's and St Thomas' who was one of the co-authors.
""Our findings suggest that ECMO delivery at specialist SRF [severe respiratory failure] centres confers significant survival benefit, compared to matched patients who received conventional therapy in referring centres,"" he said.
NHS bosses believe ECMO saved several hundred lives during the pandemic.
Prof Stephen Powis, NHS England's national medical director, said: ""This study is a testament to the incredible hard work of NHS staff over the last two years who have treated more than 700,000 Covid-19 patients in hospital including on ECMO machines, which have helped save hundreds of lives.""
The survival from Covid thanks to ECMO seen in the study is higher than in other studies of its use conducted in other countries. However, the results are not directly comparable because of differences between them such as in the selection criteria for deciding which patients received ECMO and whether people were treated in a general hospital or specialist centre, such as the two hospital trusts in the capital.
In this study, 22.9% of the ECMO and 52.9% of the non-ECMO patients died during the first wave of Covid. Mortality rose in both during the second wave, which occurred during winter 2020-21, to 26.1% and 62.4% respectively.
 This article was amended on 29 April 2022. Carbon dioxide is removed from the blood during ECMO, not added as an earlier version said.","COVID CORONAVIRUS (93%); COVID-19 CORONAVIRUS (91%); INFECTIOUS DISEASE (90%); LEVELS OF CARE (90%); HEALTH CARE PROFESSIONALS (89%); DEATH & DYING (78%); INTENSIVE CARE UNITS (78%); PUBLIC HEALTH (78%); RESPIRATORY DISORDERS & INJURIES (78%); RESEARCH REPORTS (73%); PHYSICIANS & SURGEONS (72%); WRITERS (64%)

Industry: HEALTH CARE PROFESSIONALS (89%); INTENSIVE CARE UNITS (78%); MEDIA & TELECOMMUNICATIONS (73%); EMERGENCY VEHICLES (72%); PHYSICIANS & SURGEONS (72%); WRITERS (64%)",598,The Guardian (London)
