date,title,section,body,subject,length,source
2022-12-05,New Zealand announces inquiry into Covid-19 response,WORLD NEWS; Version:1,"Your report about the start of the Covid-19 inquiry notes the concern of some of the bereaved that their testimonies are to be heard by an outsourced communications company and that they feel “marginalised” because they expected to give direct evidence to the inquiry ( Covid-19 public inquiry opens amid anger from bereaved over testimony, 4 October  ).
Apart from wondering why the chair, Lady Hallett, didn't start the public phase with some of these testimonies as a mark of respect and intent, her response to Pete Weatherby KC, representing the Covid-19 Bereaved Families for Justice group, is deeply worrying: “There is absolutely no question that the bereaved will be marginalised and I really don't want to hear that expression again.”
When families feel they are being marginalised, telling their representative that you don't want to hear that word is not the right way to resolve their concerns. John BeerVice-president, Hourglass
 My family of four endured all of the losses mentioned by Lady Hallett, the worst being the unnecessary slow, traumatic and lonely death of my beloved mother in March 2020. The nature of her demise still haunts me today.
My son suffered the loss of educational opportunities. His dream place at Cambridge University was taken away from him due to the fiasco of the 2020 A-level results.
My daughter's graduation ceremony at St Andrews University was reduced to a five-second mention of her name and degree in a video. Her subsequent master's degree at the Courtauld Institute of Art was all online, with no visits to galleries or museums.
The business that my husband and I ran could not operate throughout the restrictions, and the financial loss was crippling.
It goes without saying that all four of us in my family suffered extreme mental anguish due to all these factors. Like many others, we are still trying to rebuild our lives. Suzi ReedFerryhill, County Durham53172022-10-09T16:54:19Ztruefalse2022-10-09T16:55:00Z2022-10-10T00:00:00ZUKThe Guardianhttps://www.theguardian.com/p/md28zfalsetruehttps://media.guim.co.uk/ed0257c2d113bad3e12efa6c5d06562043f19a12/0_168_4256_2554/500.jpgfalseentrueYour report about the start of the Covid-19 inquiry notes the concern of some of the bereaved that their testimonies are to be heard by an outsourced communications company and that they feel “marginalised” because they expected to give direct evidence to the inquiry (Covid-19 public inquiry opens amid anger from bereaved over testimony, 4 October). Apart from wondering why the chair, Lady Hallett, didn't start the public phase with some of these testimonies as a mark of respect and intent, her response to Pete Weatherby KC, representing the Covid-19 Bereaved Families for Justice group, is deeply worrying: “There is absolutely no question that the bereaved will be marginalised and I really don't want to hear that expression again.” When families feel they are being marginalised, telling their representative that you don't want to hear that word is not the right way to resolve their concerns. John Beer Vice-president, Hourglass  My family of four endured all of the losses mentioned by Lady Hallett, the worst being the unnecessary slow, traumatic and lonely death of my beloved mother in March 2020. The nature of her demise still haunts me today. My son suffered the loss of educational opportunities. His dream place at Cambridge University was taken away from him due to the fiasco of the 2020 A-level results. My daughter's graduation ceremony at St Andrews University was reduced to a five-second mention of her name and degree in a video. Her subsequent master's degree at the Courtauld Institute of Art was all online, with no visits to galleries or museums. The business that my husband and I ran could not operate throughout the restrictions, and the financial loss was crippling. It goes without saying that all four of us in my family suffered extreme mental anguish due to all these factors. Like many others, we are still trying to rebuild our lives. Suzi Reed Ferryhill, County Durham1913falsefalseLetters'There is absolutely no question that the bereaved will be marginalised and I really don't want to hear that expression again,' said Lady Hallett.","COVID CORONAVIRUS (92%); COVID-19 CORONAVIRUS (92%); INVESTIGATIONS (90%); EDUCATION & TRAINING (77%); DEATH & DYING (73%); SECONDARY SCHOOLS (67%)

Industry: MEDIA & TELECOMMUNICATIONS (89%); MUSEUMS & GALLERIES (69%); SECONDARY SCHOOLS (67%)",702,The Guardian (London)
2022-10-09,Worrying words from Covid-19 inquiry chair,WORLD NEWS; Version:1,"US public health officials are bracing for a possible Covid-19  surge in the coming weeks following indoor holiday gatherings among a populace that has largely abandoned preventive measures.
Concerns over this uptick come amid rising influenza and RSV  cases in America. This so-called “ tripledemic  ”, experts warn, could further strain the already overburdened US health system.
Evidence of an increase emerged in earnest after Thanksgiving, celebrated on 24 November this year. The Centers for Disease Control and Prevention's weekly new case data  reported on 30 November stood at 308,578, rising to 470,963 in the 7 December report. In the 14 December weekly report, that number dipped to 455,028 – but ballooned to 487, 367 in the 21 December analysis.
Hospitalization admissions are also on the rise. The seven-day average from 15 to 21 December was 5,376, compared to 5,052 the prior week. Data shows this increase has been in motion since late October, following several months of declines, according to the CDC. 
This increase is being felt in different ways across the US. In Florida, Covid hospitalizations across the state remain around three-month peaks, fueled by Omicron subvariants, the Palm Beach Post reported. 
Across Washington, DC's metropolitan area, cases have gone up since Thanksgiving, but they have not reached levels seen during the 2021 holiday season, when Omicron started to take hold across the US, according to the Washington Post.  Analysis of wastewater in Houston, Texas, suggests that there is a “mini-surge” that comes in conjunction with the growing prevalence of BQ.1 and BQ.1.1  omicron subvariants, the Houston Chronicle reported. 
While these numbers pale in comparison to the winter 2022 peak in the US – with more than 5.6m new cases reported the week of 19 January – officials are working to thwart this upward trend.
Joe Biden announced  on 15 December that his administration was re-starting a program that sends free Covid-19 tests to US households through the mail service. The White House said that officials were poised to support healthcare staffing needs across the US, and that medical supplies from the national strategic stockpile were ready to ship if necessary.
Although the US is staring down a possible seasonal increase, it appears that many are not all that worried. Just 14.6% of US residents aged five and up have received their updated booster dose, which is said to provide greater protection against Omicron variants, CDC data indicate. 
There have been nearly 1.1m Covid-19 deaths in the US. More than 100m cases have been reported, according to Johns Hopkins University data.","COVID-19 CORONAVIRUS (92%); HOLIDAYS & OBSERVANCES (92%); COVID CORONAVIRUS (91%); HEALTH DEPARTMENTS (91%); PUBLIC HEALTH (91%); PUBLIC HEALTH ADMINISTRATION (91%); EPIDEMIOLOGY (90%); INFECTIOUS DISEASE (90%); INFLUENZA (90%); PUBLIC OFFICIALS (90%); DISEASE REPORTING (89%); COOKING & ENTERTAINING (78%); DISEASES & DISORDERS (78%); THANKSGIVING (78%); TRENDS (78%); TRENDS & EVENTS (78%); US FEDERAL GOVERNMENT (76%); US PRESIDENTIAL CANDIDATES 2016 (62%); US PRESIDENTIAL CANDIDATES 2020 (62%)

Organization: CENTERS FOR DISEASE CONTROL & PREVENTION (57%)

Industry: HEALTH DEPARTMENTS (91%); EPIDEMIOLOGY (90%); SEWERAGE SYSTEMS (76%); HEALTH CARE (66%)

Person: JOE BIDEN (79%)",439,The Guardian (London)
2022-12-26,US public health officials brace for possible Covid-19 surge after holidays,WORLD NEWS; Version:1,"The number of active Covid cases has exploded across the country as Australia enters its fourth wave, prompting renewed warnings to protect vulnerable aged care residents.
Jurisdictions collectively recorded more than 58,000 new cases of Covid in the past week, with some states reporting a doubling in the number of people hospitalised with the virus.
New South Wales recorded 19,800 new cases in the past seven days, Victoria had 16,636 new cases, and Western Australia recorded more than 8,000. South Australia had 6,867 new cases in the past week, Queensland recorded 5,828, and the ACT and NT had 1,194 and 369 new cases respectively. Tasmania was yet to publish its weekly case numbers by 3.30pm on Friday.
NSW's chief health officer, Dr Kerry Chant, said it was clear the country was now in its fourth wave. Chant expected that the wave would probably peak before Christmas given its current trajectory.
“The wave is taking off with some trajectory, it will be quite a steep wave and hopefully the decline will be equally as steep,” she said on Friday.
“There is a sense that the wave may well peak before Christmas and we may be on the decline [by then].
 COVID-19 weekly update – Friday 11 November 2022 In the 7 days to 4pm Thursday 10 November: -19,800 new cases of COVID-19 have been recorded: 8,392 rapid antigen tests (RATs) and 11,408 PCR tests -22 lives lost pic.twitter.com/axp37c5u6S  — NSW Health (@NSWHealth) November 11, 2022
“But the message is clear … this is an increased risk period for Covid, so please, now is the time to take those protective behaviours.”
Sign up for Guardian Australia's free morning and afternoon email newsletters for your daily news roundup
In Queensland, where hospital bed occupancy had almost doubled, the chief health officer, Dr John Gerrard, said the state had moved to an “amber alert”  for the fourth wave.
“This was always expected and we continue to see waves of Covid-19 in the coming months and even longer,” he said.
“That is why we have devised the traffic light system so that Queenslanders can know when we are entering a wave and, equally important, when we are leaving a wave, so they might modify their behaviour appropriately.”
 From 3 November to 9 November, we recorded 5,828 new COVID-19 cases. Sadly, 15 deaths were reported during this time. Full details ?? https://t.co/KjEKBzWY9v pic.twitter.com/zNGyBp0644  — Queensland Health (@qldhealth) November 11, 2022
He said the average age of Covid cases had increased with each successive wave in Queensland this year. In the first wave, the average age was 33. The average so far in this wave has been 47, he said.
“We know that older people have been less likely to get Covid during the course of the year because they have been protecting themselves,” he said. “But with each wave, we are seeing more and more older Queenslanders acquire infection.”
Victoria said it had recorded an 18.1% increase in hospitalisations, and that the average daily number of new cases was 2,377 this week, up from 1,471 last week. The state's chief health officer, Prof Brett Sutton, said the increasing hospitalisations had been driven by the emerging Omicron subvariants including BQ.1 and XBB.
 This week we reported 16,636 new cases, averaging 274 daily hospitalisations and 11 daily ICU admissions. 41 deaths were reported in the past 7 days. Our thoughts are with those in hospital, and the families of people who have lost their lives. pic.twitter.com/EZlNU1TJPF  — VicGovDH (@VicGovDH) November 10, 2022
“There is currently no evidence to suggest these subvariants cause more severe disease,” he said. “However, hospitalisation rates are likely increasing due to waning immunity from past vaccination and the ability of these new subvariants to escape immunity from past infection.”
The aged care sector is also warning Australians to take extra precautions to protect vulnerable residents.
The Aged & Community Care Providers Association chief executive, Tom Symondson, urged anyone who was entering an aged care home to take a rapid test or wear a mask, and he urged staff who have tested positive to stay away from residents.
 South Australian weekly COVID-19 update 11/11/22. For more information go to https://t.co/XkVcAmeZ6V pic.twitter.com/eADUuMV8vm  — SA Health (@SAHealth) November 11, 2022
“Aged care providers are well equipped and prepared with supplies of PPE and their IPC protocols to manage Covid outbreaks, but we must continue to do everything we can to keep our residents and clients safe,” he said.
“We ask visitors to support staff in ensuring their loved ones are protected and remember to show your appreciation for their commitment in incredibly challenging circumstances.”
 This is our WA COVID-19 weekly update. https://t.co/uoWTTWm99r pic.twitter.com/Rr1s6PW9N9  — Mark McGowan (@MarkMcGowanMP) November 11, 2022
Health department data shows the proportion of Australians with a fourth vaccine dose is about 42.1%. The vast majority (89.6%) have had two doses or more and 72% have had their third dose booster.
The vast majority of aged care residents have had four doses or more, and 99% of aged care staff have had at least two doses.","COVID CORONAVIRUS (95%); COVID-19 CORONAVIRUS (91%); INFECTIOUS DISEASE (90%); PUBLIC HEALTH ADMINISTRATION (78%); VULNERABLE ADULTS (78%); DEATH & DYING (73%); NEWS BRIEFS (73%); HOSPITAL OCCUPANCY RATES (50%)

Industry: PODCASTING (78%); MEDIA & TELECOMMUNICATIONS (73%); ELECTRONIC PUBLISHING (69%); IMMUNOLOGIC FACTORS (64%); HOSPITAL OCCUPANCY RATES (50%); TRAFFIC SIGNALS (50%)",858,The Guardian (London)
2022-11-11,Covid-19 case numbers exploding across Australia as fourth wave takes off,AUSTRALIA NEWS; Version:2,"Ministers will have a year to prepare before cross-examination at the UK's Covid-19 public inquiry , its chair, Heather Hallett, announced, as she opened what is likely be one of the broadest statutory investigations in the country's history.
The first cross-examinations of the government response to the pandemic, including decisions on lockdowns, maintaining public confidence and handling of scientific advice, will begin in summer 2023, three and a half years after the arrival of coronavirus, which has claimed more than 200,000 lives in the UK. 
Hearings on the UK's preparedness will start in late spring 2023, as Lady Hallett said she wanted to move as “speedily as possible so lessons are learned before another pandemic strikes”.
Boris Johnson had been repeatedly criticised by campaigners for the bereaved and Labour for delaying the launch of the inquiry. Hallett said it would scrutinise the “performance and effectiveness” of central government decision-making and its messaging – topics likely to expose current and former ministers.
The inquiry has powers to compel the production of evidence and appearances of witnesses.
Johnson's official spokesperson said the PM planned to cooperate with the inquiry. “It was the prime minister who established the inquiry and signed off on the terms of reference,” he said.
To make the “demanding” terms of reference more digestible, Hallett will break the inquiry into modules, with teams investigating and commissioning research on different issues. Hearings will run sequentially, suggesting proceedings could take a number of years.
At least eight other modules are likely to follow, but will not be announced until next year. These include: vaccines, therapeutics and anti-viral treatment; the care sector; government procurement and personal protective equipment; testing and tracing; government business and financial responses; health inequalities and the impact of Covid-19; education, children and young persons; and the impact of Covid-19 on public services and other sectors.
Hallett, a retired court of appeal judge and a crossbench peer, said people and organisations would have to apply to be core participants for each module.
Jo Goodman, co-founder of the Covid-19 Bereaved Families for Justice campaign, said: “Today was an emotional day for those of us who have lost loved ones and it meant a lot to hear Baroness Hallett recognise the 'devastating nature of bereavement' and the pain we have been through. Hopefully this will be reflected by not making bereaved families go through the stressful and draining process of applying to be core participants in every single module.”
Hallett also announced the public would be able to take part through a “listening exercise”, to begin later this year, which would gather the experiences of people most affected and “from those whose voices are not always heard”.
The responses will be analysed to highlight key themes, but individual accounts will not be investigated, to prevent an already sprawling inquiry from getting out of control.
Hallett said she would “need to be ruthless” and it would be impossible to call every witness, adding that the inquiry must focus on the key issues.
But she emphasised that inequalities would be “at the forefront” of the investigation.
“Those who have suffered the most want to know if anything could have been done to prevent or reduce their suffering, and that is why this inquiry has been established,” she said.
Hearings will take place in different parts of the UK, including in Scotland, Wales and Northern Ireland, and Hallett said her aim was to be “thorough and efficient, rigorous and fair”. When it came to gathering evidence she would speak out against “people or organisations who stand in the way”.
Lawyers have already asked the government for assurances it would not block the release of key information amid fears that doing so could expose it to claims for damages from families who lost loved ones.
Elkan Abrahamson, head of major inquests and inquiries at Broudie Jackson Canter, who represents bereaved families, said: “It is of fundamental importance that we have access to all relevant documents and that the government offers full disclosure to the inquiry. The bereaved would regard anything less than full disclosure as a coverup.”","INVESTIGATIONS (92%); COVID CORONAVIRUS (91%); COVID-19 CORONAVIRUS (91%); INFECTIOUS DISEASE (90%); NEGATIVE PERSONAL NEWS (90%); WITNESSES (90%); EPIDEMICS (89%); GOVERNMENT & PUBLIC ADMINISTRATION (89%); PUBLIC HEALTH (89%); FAMILY (85%); GOVERNMENT PROCUREMENT (78%); HEALTH EQUITY (78%); VACCINES (78%); CORONAVIRUSES (77%); PRIME MINISTERS (77%); APPEALS (76%); APPELLATE DECISIONS (76%); VIRUSES (76%); ASSOCIATIONS & ORGANIZATIONS (73%); PERSONAL PROTECTIVE EQUIPMENT (73%); EMOTIONS (71%); JUDGES (70%); CHILDREN, ADOLESCENTS & TEENS (67%); APPEALS COURTS (50%); PURCHASING & PROCUREMENT (50%)

Company:  GOODMAN CO LTD (63%)

Industry: NAICS339113 SURGICAL APPLIANCE & SUPPLIES MANUFACTURING (63%); SIC3842 ORTHOPEDIC, PROSTHETIC, & SURGICAL APPLIANCES & SUPPLIES (63%); HEALTH EQUITY (78%); VACCINES (78%); MEDIA & TELECOMMUNICATIONS (73%); ANTIVIRALS (63%)

Person: BORIS JOHNSON (79%)",716,The Guardian (London)
2022-07-21,Public inquiry into UK Covid-19 response opens,WORLD NEWS; Version:3,"A new wave of Covid-19 infections is looming in New South Wales, the state's chief health officer, Dr Kerry Chant, will warn on Thursday, with transmission of the virus predicted to increase in coming weeks.
It follows Victoria's chief health officer, Prof Brett Sutton, making a similar announcement last week , with Omicron subvariants BQ.1 and XBB tipped to overtake BA.5 as the dominant variants throughout Australia.
Chant is expected on Thursday to  reiterate the importance of getting booster doses, and will again urge those most at risk of severe disease to plan ahead by talking to their doctor about the antivirals available to reduce the severity of infection.
She will also urge people to stay home if they have cold or flu-like symptoms  and ask those who must leave the house while unwell to wear a mask when indoors or on public transport. They should avoid large gatherings and high-risk settings, such as hospitals and aged or disability care facilities, for at least seven days.
Omicron subvariants BQ.1 and XBB are driving significant cases and hospitalisations overseas  due to their ability to escape immunity from past infection – and due to waning immunity from past vaccination. 
The World Health Organization does not consider the two subvariants as different enough from other circulating Omicron subvariants to warrant their classification as new variants of concern. But the two sublineages remain part of Omicron, which is a variant of concern.
The WHO has said there is no epidemiological data to suggest an increase in disease severity due to the variants.
“Cases of reinfection were primarily limited to those with initial infection in the pre-Omicron period,” a WHO statement published on 27 October said. “As of now, there are no data to support escape from recent immune responses induced by other Omicron lineages.”
 New COVID-19 update from @NSWCHO  “We are starting to see an increase of COVID-19 cases and changes in the variants circulating in NSW, which tells us we are entering the next COVID-19 wave”. More info https://t.co/qty0m3JEmt pic.twitter.com/Ngtac3ptbj  — NSW Health (@NSWHealth) November 3, 2022
Sign up for our free morning and afternoon email newsletters from Guardian Australia for your daily news roundup
The latest NSW respiratory diseases surveillance report , published later on Thursday morning, found data indicated the start of a new wave of Covid infections.
There were 9,707 people diagnosed with Covid in the week ending 29 October, an increase of 11.4% since the previous week, the report said. Emergency department presentations requiring admission increased to 118 from 96 in the previous week.
The federal health minister, Mark Butler, said on Thursday “there is evidence of a small increase at this stage in case numbers … coming off a very big decline that we've seen over the last couple of months”.
“We're monitoring that very, very closely,” he said.
“I just want to reiterate really, the advice of Kerry Chant this morning, the New South Wales Chief Health Officer: that this is a timely reminder to get your booster, to make sure that you are up to date with your vaccination.” There are 5m Australians over the age of 16, who are eligible for a third dose but have not yet had it, he said.
“For many of them, it will be more than 12 months since they had their second dose.”
On Saturday, the Victorian premier, Daniel Andrews, said fluctuations in case numbers would continue and “Covid will be with us in one form or another for quite a long time”.
“But we are treating it in a different way now because you've got to move beyond this,” he said.
“We're going to see Covid numbers go up and down. Whether it's a wave or whether it's a spike, I'll leave that for others to determine. This era of Covid exceptionalism has to end, and it has. National cabinet has made those decisions.”
Meanwhile, results from two complementary national serosurveys, one in children and adolescents and one in adults, were published on Thursday to provide a snapshot of the extent of infections across Australia to the end of August.
Serosurveys involve conducting tests on blood samples taken from thousands of Australians across various age groups, geographical locations and target populations. Researchers look for antibodies to the virus in the blood to determine the extent a population has been affected.
The children and adolescents survey found at least 64% of 0 to 19-year-olds in Australia had been infected with Covid-19.
Dr Archana Koirala, an infectious disease specialist at the National Centre for Immunisation Research and Surveillance and paediatric study lead, said: “Overall, this study tells us that at least two-thirds of children in Australia have had Covid-19.”
“This is more than double the number of cases reported based on nose and throat swab testing for the virus,” she said. “This is expected since many children have either mild or no symptoms and are therefore not tested for the virus.”
In children aged one to four years old, approximately eight out of 10 had evidence of past infection. This group was not eligible for vaccination at the time of the serosurveys; however,  high-risk, severely immunocompromised children aged six months to four years became eligible for vaccination from September.
The adult study found at least 65% of adults in Australia had been infected by the virus, similar to the proportion of children and adolescents.","COVID-19 CORONAVIRUS (93%); COVID CORONAVIRUS (91%); DISEASE IMMUNITY (90%); INFECTIOUS DISEASE (90%); VACCINES (90%); DISEASES & DISORDERS (89%); EPIDEMIOLOGY (89%); HEALTH DEPARTMENTS (89%); PUBLIC HEALTH ADMINISTRATION (89%); COMMON COLD (78%); DISEASE REPORTING (78%); EMERGENCY ROOMS (78%); PUBLIC HEALTH (78%); PUBLIC HEALTH SURVEILLANCE (78%); VACCINATION & IMMUNIZATION (78%); VIRUSES (78%); ASSOCIATIONS & ORGANIZATIONS (73%); NEWS BRIEFS (73%); RESPIRATORY DISORDERS & INJURIES (73%); UNITED NATIONS INSTITUTIONS (71%); SURVEILLANCE (70%)

Organization: WORLD HEALTH ORGANIZATION (72%)

Industry: VACCINES (90%); EPIDEMIOLOGY (89%); HEALTH DEPARTMENTS (89%); EMERGENCY ROOMS (78%); PODCASTING (78%); VACCINATION & IMMUNIZATION (78%); MEDIA & TELECOMMUNICATIONS (73%); ELECTRONIC PUBLISHING (63%)",902,The Guardian (London)
