date,title,section,body,subject,length,source
2021-01-29,Will Covid-19 sniffing dogs allow fans back into sporting events?,SPORT; Version:1,"Ellen DeGeneres has tested positive for Covid-19, the daytime TV talkshow host revealed on Thursday.
“Hi everyone, I want to let you all know that I tested positive for COVID-19,” DeGeneres, 62, wrote in a Notes app screenshot posted to her social media channels. “Fortunately, I'm feeling fine right now.”
pic.twitter.com/8pKdgCXY1z  — Ellen DeGeneres (@TheEllenShow) December 10, 2020
DeGeneres also revealed that she had already notified close contacts and was “following all proper CDC guidelines”.
An insider confirmed to the Hollywood Reporter  that production on her show will now be paused until January.
LA county, where her show films, is continuing to see a rise in cases, with 9,243 on Wednesday, the second highest daily total since the virus first started.
The news comes after a difficult year for the comedian, as she faced charges of turning a blind eye to alleged toxic behavior  by producers on her show. A Buzzfeed News report  from July spoke to 36 anonymous employees who said the fear-based culture behind the scenes at The Ellen DeGeneres Show diverged sharply from the host's “be kind” mantra.
Reports of DeGeneres's alleged mean-spiritedness  and backstage turmoil prompted a taped mea culpa. “If I've ever let someone down, if I've ever hurt their feelings, I am so sorry for that,” DeGeneres said at the time. “If that's ever the case, I've let myself down and I've let myself down as well.”
The award-winning NBC daytime show returned in September after an internal investigation into complaints of bullying, racism and sexual misconduct resulted in the exit of three top producers  from the show.
This week also saw a follow-up report  from Buzzfeed News that claimed advertisers and celebrities had been avoiding any association with the show after recent controversies. Ratings have also declined 37% since the last season.",,307,The Guardian (London)
2020-12-10,Ellen DeGeneres tests positive for Covid-19,TELEVISION & RADIO; Version:1,"An editorial about Covid-19 said ""there is a projected death toll of 20,000 by next April"". That was referring to an analysis by the UK group Independent Sage, which found that 20,000 more people could die by next April ( Johnson is in danger of leading the UK down the same road as the US, 27 June, page 3, Journal).
 We wrote that François Fillon was forced to abandon his presidential campaign in 2017. To clarify: he lost in the first round ( Former French PM Fillon and wife given jail terms for fraud, 30 June, page 21).
 Other recently amended articles include:
No 10 accused of sowing confusion over Leicester lockdown
England's roads set for busiest weekend of the year as lockdown eased
Scots Gaelic could die out within a decade, study finds
Electric cars gain market share in Europe despite Covid-19 crisis
Eileen Farrell obituary
Petrol sold to Nigeria from Europe 'dirtier' than black market 'bush' fuel
Shepherd: The Hero Dog review - Nazi-era drama strikes the right tone
                                            5                       171                       2020-07-02T20:00:01Z                       false                       false                       2020-07-02T20:33:54Z                       2020-07-03T00:00:00Z                       UK                       The Guardian                       https://gu.com/p/e8czz                       false                       true                       false                       en                       true                        An editorial about Covid-19 said ""there is a projected death toll of 20,000 by next April"". That was referring to an analysis by the UK group Independent Sage, which found that 20,000 more people could die by next April (Johnson is in danger of leading the UK down the same road as the US, 27 June, page 3, Journal).  We wrote that François Fillon was forced to abandon his presidential campaign in 2017. To clarify: he lost in the first round (Former French PM Fillon and wife given jail terms for fraud, 30 June, page 21).  Other recently amended articles include: No 10 accused of sowing confusion over Leicester lockdown England's roads set for busiest weekend of the year as lockdown eased Scots Gaelic could die out within a decade, study finds Electric cars gain market share in Europe despite Covid-19 crisis Eileen Farrell obituary Petrol sold to Nigeria from Europe 'dirtier' than black market 'bush' fuel Shepherd: The Hero Dog review - Nazi-era drama strikes the right tone                       989                       false                       false                                                Corrections and clarifications column editor","COVID CORONAVIRUS (93%); COVID-19 CORONAVIRUS (93%); DEATH & DYING (90%); DEATH NOTICES & OBITUARIES (90%); NEGATIVE PERSONAL NEWS (90%); FRENCH PRIME MINISTERS (89%); NEGATIVE NEWS (89%); RESEARCH REPORTS (89%); ELECTRIC VEHICLE INDUSTRY (73%); ELECTRIC VEHICLES (68%)

Industry: MARKET SHARE (75%); ELECTRIC VEHICLE INDUSTRY (73%); ELECTRIC VEHICLES (68%)

Person: FRANCOIS FILLON (90%)",453,The Guardian (London)
2020-07-02,Corrections and clarifications Covid-19 projection | François Fillon,NEWS; Version:1,"As Covid case numbers rise in New South Wales and Victoria, people across Australia are being urged to get a vaccine booster dose as soon as they are eligible.
Health professionals have warned of problems caused by an increased demand for booster shots, after the emergence of the Omicron variant and a shortening of the interval between vaccine doses.
Both GPs and pharmacist have spoken of issues with the booster rollout, from running out of vaccine to staff shortages.
So where can you get a booster shot and how soon?
                                        Are you eligible?                                      
The first thing to do is check whether you're eligible by looking at the date of your second dose.
People 18 years and older who had their second dose of any Covid-19 vaccine five months or more ago are eligible to get a booster of either the Pfizer or Moderna vaccines, even if they had AstraZeneca as their first vaccine.
People who had AstraZeneca as their first two doses can have it as their third if they so choose.
The only exclusion on booster doses is those who are immunocompromised and have already had a third dose.
                                        Where can I get it?                                      
More than 8,500 GPs, community pharmacies, Aboriginal community controlled health organisations, commonwealth and state government clinics are able to offer either the Moderna or Pfizer boosters.
More than 670,000 booster shots have already been administered in Australia.
The federal health department's website  will let you plug in your postcode and the vaccine type you are after to find the clinics near you. However it has limited information on what availability those clinics have.
Alternatively, click below for clinic locations in your state or territory:
Queensland Victoria New South Wales Western Australia Northern Territory South Australia ACT Tasmania
Many of these places have walk-in appointments, especially pharmacies, so you will not need to book, but it is worth calling ahead in advance to see if they have stock.
Boosters remain free of charge.
                                        Can I book an appointment?                                      
If you prefer to book ahead, or if you're not quite at the five month mark, you can book through those sites.
The best site around for finding Covid-19 vaccine appointments is one developed unofficially by Sydney-based developer Ken Tsang called Covid-19 Near Me.  Using data from what he says is a ""range of sources"", the website points out on maps where you can find Covid-19 vaccines, and whether those places have any stock.
The site will then direct you to the clinic or medical centre's booking page to make your booking.","VACCINES (97%); COVID CORONAVIRUS (91%); COVID-19 CORONAVIRUS (91%); INFECTIOUS DISEASE (90%); ASSOCIATIONS & ORGANIZATIONS (78%); DISEASE IMMUNITY (78%); OUTPUT & DEMAND (78%); PHARMACISTS (78%); HEALTH CARE PROFESSIONALS (77%); HEALTH DEPARTMENTS (77%); PROFESSIONAL WORKERS (77%); PUBLIC HEALTH ADMINISTRATION (73%); INDIGENOUS PEOPLES (72%); REGIONAL & LOCAL GOVERNMENTS (65%); GOVERNMENT & PUBLIC ADMINISTRATION (51%)

Company:  PFIZER INC (91%);  ASTRAZENECA A/S (91%)

Ticker: PFZ (LSE) (91%); PFE (NYSE) (91%)

Industry: NAICS325414 BIOLOGICAL PRODUCT (EXCEPT DIAGNOSTIC) MANUFACTURING (91%); NAICS325412 PHARMACEUTICAL PREPARATION MANUFACTURING (91%); NAICS325411 MEDICINAL & BOTANICAL MANUFACTURING (91%); SIC2836 BIOLOGICAL PRODUCTS, EXCEPT DIAGNOSTIC SUBSTANCES (91%); SIC2834 PHARMACEUTICAL PREPARATIONS (91%); SIC2833 MEDICINAL CHEMICALS & BOTANICAL PRODUCTS (91%); VACCINES (97%); PHARMACEUTICALS INDUSTRY (90%); PHARMACEUTICALS & BIOTECHNOLOGY (89%); PHARMACISTS (78%); HEALTH CARE PROFESSIONALS (77%); HEALTH DEPARTMENTS (77%); PHARMACIES (76%); PHARMACIES & DRUG STORES (76%); RETAIL PHARMACEUTICALS (72%)",454,The Guardian (London)
2021-12-17,Demand for Covid-19 vaccine boosters is surging in Australia: here's how to get yours,AUSTRALIA NEWS; Version:1,"The vaccine manufacturer Moderna is considering Australia as part of a clinical trial to test its Covid-19 vaccine in children.
In its latest quarterly report filed in the United States to the federal financial regulatory agency, Moderna indicated it would test the safety and efficacy of its Covid vaccine in 6,000 healthy children aged between six months and 12 years.
The pharmaceutical company reported it would enrol participants ""in the US and up to two ex-US countries (eg. Canada and/or Australia)"".
The trial, which is planned to run until mid-2023 , is staggering recruitment across three age groups: first in children aged between six and 12, then children aged between two and six, and finally babies between six months and two years old.
The study will test the Covid vaccine's safety as well as reactogenicity - its tendency to produce common adverse effects, such as fever or a sore arm.
The report to the US Securities and Exchange Commission comes as the Australian government announced on Sunday the Moderna vaccine would become available  in Australia from mid-September.
Greg Hunt, the federal health minister, said Australia's Therapeutic Goods Administration was likely to approve the Moderna vaccine for use in the coming fortnight, with one million doses of the vaccine available in the middle of September.
Sign up to receive an email with the top stories from Guardian Australia every morning
In total, 10 million Moderna vaccine doses are expected to be delivered this year, with an additional 15m booster doses secured for 2022.
The vaccine has been approved for use in many jurisdictions internationally, including the US, the European Union and Singapore.
The Moderna vaccine is likely to be administered as two doses given 28 days apart. Like the Covid jab manufactured by Pfizer, it is an mRNA vaccine  : it uses a segment of genetic code that triggers the production of the coronavirus's spike protein in the body, which immune cells then mount a response against.
In the US, Pfizer has also commenced clinical trials of its Covid-19 vaccine in children aged between six months and 12 years.","VACCINES (97%); COVID CORONAVIRUS (94%); DRUG SAFETY (94%); CHILDREN (91%); COVID-19 CORONAVIRUS (91%); INFECTIOUS DISEASE (90%); SAFETY (90%); BIOLOGICS MFG (89%); DRUG & MEDICAL DEVICES APPROVAL (89%); APPROVALS (77%); BANKING & FINANCE REGULATION (77%); US FEDERAL GOVERNMENT (77%); CORONAVIRUSES (76%); DEMOGRAPHIC GROUPS (73%); GENES & CHROMOSOMES (73%); NEWS BRIEFS (73%); PUBLIC HEALTH ADMINISTRATION (73%); VIRUSES (73%); HEALTH DEPARTMENTS (72%); GOVERNMENT ADVISORS & MINISTERS (67%); EUROPEAN UNION (66%)

Company:  PFIZER INC (58%)

Organization: SECURITIES & EXCHANGE COMMISSION (55%)

Ticker: PFZ (LSE) (58%); PFE (NYSE) (58%)

Industry: NAICS325414 BIOLOGICAL PRODUCT (EXCEPT DIAGNOSTIC) MANUFACTURING (58%); NAICS325412 PHARMACEUTICAL PREPARATION MANUFACTURING (58%); NAICS325411 MEDICINAL & BOTANICAL MANUFACTURING (58%); SIC2836 BIOLOGICAL PRODUCTS, EXCEPT DIAGNOSTIC SUBSTANCES (58%); SIC2834 PHARMACEUTICAL PREPARATIONS (58%); SIC2833 MEDICINAL CHEMICALS & BOTANICAL PRODUCTS (58%); VACCINES (97%); DRUG SAFETY (94%); DRUG AVAILABILITY (90%); MANUFACTURING (90%); MRNA DRUGS (90%); PEDIATRIC DRUGS (90%); PHARMACEUTICAL PREPARATION MFG (90%); PHARMACEUTICALS & BIOTECHNOLOGY (90%); PHARMACEUTICALS INDUSTRY (90%); PHARMACEUTICALS PRODUCT DEVELOPMENT (90%); BIOLOGICS MFG (89%); BIOPHARMACEUTICALS INDUSTRY (89%); DRUG & MEDICAL DEVICES APPROVAL (89%); DRUG EFFICACY (79%); BANKING & FINANCE REGULATION (77%); BANKING & FINANCE REGULATION & POLICY (77%); MEDIA & TELECOMMUNICATIONS (73%); HEALTH DEPARTMENTS (72%)",352,The Guardian (London)
2021-08-09,Moderna considers including Australian children in Covid-19 vaccine trial,WORLD NEWS; Version:1,"It has been touted as a breakthrough treatment by Donald Trump, and there are hopes that blood plasma containing coronavirus antibodies may help British patients during the second wave of Covid-19 as well.
But a study, which is published in the British Medical Journal (BMJ) on Friday, suggests ""convalescent plasma"" has only limited effectiveness and fails to reduce deaths or stop the progression to severe disease.
Plasma is the clear, yellowish liquid part of the blood which carries red and white blood cells and platelets around the body. After an infection, plasma is often packed with antibodies generated by the immune system. As such, it is sometimes harvested from people who have recovered from a disease and transfused into patients who are fighting it. This convalescent plasma therapy was used during the 1918 flu pandemic, as well as during more recent global health emergencies, treating patients with Sars or Ebola.
Various trials around the world are exploring whether convalescent plasma could help reduce deaths and serious complications from Covid-19, with the largest randomised controlled trial taking place in the UK.
Despite the findings of the latest published study, convalescent plasma may yet prove to be effective against Covid-19.
The research involved 464 adults with moderate Covid-19 who were admitted to hospitals in India between April and July. Approximately half received two transfusions of convalescent plasma, 24 hours apart, alongside standard care, while the control group received standard care only.
One month later, 19% of those who received the plasma had progressed to severe disease or had died of any cause, compared with 18% in the control group. Plasma therapy did, however, seem to reduce symptoms, such as shortness of breath and fatigue, after seven days.
A spokesperson for NHS Blood and Transplant, which is collecting plasma from people who have recovered from Covid-19, emphasised that UK-based studies are only infusing plasma that contains high levels of coronavirus antibodies. He said the Indian study used plasma with antibody levels around six to 10 times lower than that.
The Indian researchers agreed that further studies using high antibody levels may find it to be more effective. An interim analysis of 136 Covid-19 patients in a trial at Houston Methodist hospital in Texas suggested a significant reduction in deaths among patients who received plasma with high levels of antibodies early in the course of their disease.
Followup data from all 351 patients in the Texas study has been published as a preprint and supports this conclusion, although plasma transfusion later in the course of the disease had no significant effect on death rates regardless of antibody levels. ""With respect to altering mortality, our analysis identified an optimal window of 44 hours post-hospitalisation for transfusing Covid-19 patients with high titre convalescent plasma,"" they wrote.
Prof Paul Morgan, the director of the Systems Immunity Research Institute at Cardiff University and a member of the British Society for Immunology's expert taskforce on immunology and Covid-19, said there were other reasons for optimism. For one thing, he said, the study suggested plasma therapy was associated with a reduction in viral load, ""so, there does seem to be an antiviral effect of the therapy, even if it isn't reflected in the final outcomes"".
The study also hinted that infusing patients with large amounts of donated plasma could lead to a small but significant increase in deaths. ""It might be worth considering, rather than giving just convalescent plasma, taking the antibodies out of the plasma and using those,"" Morgan said. Such purified antibodies are already used to treat patients with antibody deficiencies.","COVID CORONAVIRUS (94%); COVID-19 CORONAVIRUS (94%); CORONAVIRUSES (91%); VIRUSES (91%); DISEASES & DISORDERS (90%); INFECTIOUS DISEASE (90%); MEDICAL RESEARCH (90%); RESEARCH REPORTS (90%); BLOOD TRANSFUSIONS (89%); DEATH & DYING (89%); DEATH RATES (89%); WRITERS (89%); DISEASE IMMUNITY (78%); EBOLA VIRUS DISEASE (78%); EXPERIMENTATION & RESEARCH (78%); INFLUENZA (78%); PANDEMICS (78%); RESPIRATORY DISORDERS & INJURIES (78%); SARS (78%); PUBLIC HEALTH (77%); RESEARCH INSTITUTES (77%); BLOOD DONATIONS (73%); EPIDEMICS (73%); TROPICAL DISEASES (72%); COLLEGE & UNIVERSITY PROFESSORS (60%)

Industry: IMMUNOLOGIC FACTORS (90%); WRITERS (89%); ACADEMIC MEDICAL CENTERS (78%); HOSPITALS (78%); MEDIA & TELECOMMUNICATIONS (73%); COLLEGE & UNIVERSITY PROFESSORS (60%)

Person: DONALD TRUMP (58%)",627,The Guardian (London)
2020-10-23,"Covid-19 blood plasma therapy has limited effect, study finds",WORLD NEWS; Version:1,"Looking at how health services in different countries have responded  to Covid, we can see some common ground. Many countries are increasing funding for health services, expanding the number of frontline clinical staff, providing separate areas to care for patients with confirmed or suspected Covid-19, and using digital technology to deliver virtual rather than face-to-face appointments.
But there are some distinctions: peer a bit closer and it is clear that we have something to teach and something to learn  from every healthcare system. The UK has its achievements to share, from a nationalised (and devolved) system that can pool surgical resources in local areas and support mass trials to test new treatments, to a historically strong primary care model that played a key role in delivering the largest vaccination programme in British history while continuing to deliver daily care to patients.
There is also much we can learn from other nations. Some of the countries affected by Sars, such as Singapore, developed new types of facilities  with more single and isolation rooms, better ventilation, and versatile designs that could be rapidly adapted for surges in demand. The government's new hospital building programme  must ensure that NHS facilities are better suited to cope with future pandemics.
We can also learn from the way in which other countries increase their health and care workforce during surges of demand like pandemics. Even before Covid-19, some states such as France had established permanent reserve  lists of workers who can be rapidly expanded and mobilised to support health services. Other countries that mandate community service often offer placements in hospitals, ambulance services and nursing homes. During Covid-19 the NHS workforce was boosted by a dedicated corps of volunteers, retired clinicians, and clinical students, but exploring other approaches  to rapidly expanding our health and care workforce would be prudent with future pandemics in mind.
Although virtual GP and outpatient appointments ballooned here, other countries with more advanced health-data systems have gone further and faster in using digital technology to support health services. In countries such as Singapore and Denmark, self-driving disinfection robots helped clean clinical environments and ""command centres"" were developed to coordinate health service responses based on real-time data. The NHS worked hard  to collect and use data in a more sophisticated way during Covid-19, but a more sustained commitment to digital technology will be needed to give the UK the modern tools it needs to face future pandemics.
The final international lesson is the simplest: give your health and care system the resources it needs to be resilient. The NHS went into the pandemic with rising waiting lists for care, hospitals full to bursting and fewer doctors, nurses and intensive care beds than comparable  countries. And successive governments have ducked the issue of social care reform while countries like Japan and Germany acted  decades ago to shore up their social care systems. According to the Care Quality Commission, this inaction has left the UK's health care and social care systems facing a "" tsunami of unmet need  "" and hospitals full of stranded patients who could be discharged if they had the support they needed when out of hospital.
Our health and care system was agile enough to create emergency field hospitals, transform general hospital wards into intensive care areas and use available private sector capacity during the pandemic. But it is hard to shake the impression that the NHS was having to press the accelerator harder because it was starting near the back of the queue. The promises of social care funding reform and a new funding deal for the NHS are welcome, but these come with much ground to make up after a decade where funding failed to keep pace with rising demand and a health and care staffing crisis was allowed to develop.
Recently published data  show the UK is still towards the middle of the pack of industrialised nations when it comes to funding our health service, lagging behind countries like France and Germany. Although the government has promised a new funding deal for the NHS, it is unlikely that this will send us to the top of the international leaderboard on health funding. And the new investment - while clearly substantial - is unlikely to be enough  to meet the medium-term pressures on a service that will be fighting fires on multiple fronts, as it continues to battle Covid-19 and tackle the burgeoning waiting lists for care that grew during the pandemic.
                                                               Siva Anandaciva is chief analyst of policy at the King's Fund, an independent charitable organisation working to improve health and care in England","COVID CORONAVIRUS (92%); COVID-19 CORONAVIRUS (91%); EPIDEMICS (90%); INFECTIOUS DISEASE (90%); LABOR SHORTAGES (90%); NEGATIVE NEWS (90%); PUBLIC HEALTH (90%); HEALTH CARE PROFESSIONALS SHORTAGES (89%); LABOR FORCE (89%); LEVELS OF CARE (89%); NATIONAL HEALTH INSURANCE (89%); PANDEMICS (89%); HUMAN RESOURCES & PERSONNEL MANAGEMENT (78%); SOCIETY, SOCIAL ASSISTANCE & LIFESTYLE (78%); INTENSIVE CARE UNITS (77%); HISTORY (74%); VACCINATION & IMMUNIZATION (73%); VACCINES (73%); EDITORIALS & OPINIONS (59%); REPORTS, REVIEWS & SECTIONS (59%); AMBULANCE & RESCUE SERVICES (50%)

Industry: HEALTH CARE PROFESSIONALS SHORTAGES (89%); HOSPITALS (89%); NATIONAL HEALTH INSURANCE (89%); NEW CONSTRUCTION (78%); HEALTH CARE (77%); INTENSIVE CARE UNITS (77%); NURSING & RESIDENTIAL CARE FACILITIES (77%); NURSING HOMES (77%); LONG TERM HEALTH CARE (73%); VACCINATION & IMMUNIZATION (73%); VACCINES (73%); EMERGENCY VEHICLES (72%); AMBULANCE & RESCUE SERVICES (50%)",817,The Guardian (London)
